,page_number,position,result_type,title,link,result_id,publication_info_summary,snippet,cited_by_count,cited_by_link,cited_by_id,total_versions,all_versions_link,all_versions_id,file_format,file_title,file_link
490,25,11,,Acceptance of a COVID-19 vaccine and its related determinants among the general adult population in Kuwait,https://www.karger.com/Article/Abstract/514636,TTSMG3xNlAoJ,"Y Alqudeimat, D Alenezi, B AlHajri… - Medical Principles and …, 2021 - karger.com",… 2019 (COVID-19) vaccine among the … a COVID-19 vaccine was inferred if participants indicated that they “definitely or probably will accept vaccination against COVID-19 once a vaccine …,118,"https://scholar.google.com/scholar?cites=762319432365913165&as_sdt=20005&sciodt=0,9&hl=en&num=20",762319432365913165,11,"https://scholar.google.com/scholar?cluster=762319432365913165&hl=en&num=20&as_sdt=0,9&as_ylo=2019",762319432365913165,PDF,karger.com,https://www.karger.com/Article/PDF/514636
491,25,12,,Measuring the impact of exposure to COVID-19 vaccine misinformation on vaccine intent in the UK and US,https://www.medrxiv.org/content/10.1101/2020.10.22.20217513.abstract,YbCOYRPgvQsJ,"S Loomba, A de Figueiredo, SJ Piatek, K de Graaf… - MedRxiv, 2020 - medrxiv.org",… misinformation impacts COVID-19 vaccine uptake intent and … misinformation around a COVID-19 vaccine induces a fall in … to COVID-19 and vaccines COVID-19 vaccine misinformation …,35,"https://scholar.google.com/scholar?cites=846078678861262945&as_sdt=20005&sciodt=0,9&hl=en&num=20",846078678861262945,8,"https://scholar.google.com/scholar?cluster=846078678861262945&hl=en&num=20&as_sdt=0,9&as_ylo=2019",846078678861262945,PDF,medrxiv.org,https://www.medrxiv.org/content/10.1101/2020.10.22.20217513.full.pdf
492,25,13,Pdf,A vaccine is not too far for COVID-19,https://www.jidc.org/index.php/journal/article/download/12744/2249,ysAYY_ybdcIJ,"SK Patel, M Pathak, R Tiwari, MI Yatoo, YS Malik… - The Journal of Infection …, 2020 - jidc.org","… Besides this, some candidates like BNT162, Self-amplifying RNA vaccine, Plant-based COVID-19 vaccine, Ii-Key peptide COVID-19 vaccine, and oral recombinant COVID-19 vaccine …",26,"https://scholar.google.com/scholar?cites=14012277323929796810&as_sdt=20005&sciodt=0,9&hl=en&num=20",14012277323929796810,11,"https://scholar.google.com/scholar?cluster=14012277323929796810&hl=en&num=20&as_sdt=0,9&as_ylo=2019",14012277323929796810,PDF,jidc.org,https://www.jidc.org/index.php/journal/article/download/12744/2249
493,25,14,Html,"The advisory committee on immunization practices' interim recommendation for allocating initial supplies of COVID-19 vaccine—United States, 2020",https://www.ncbi.nlm.nih.gov/pmc/articles/PMC7737687/,gna7cYodIkcJ,"K Dooling, N McClung, M Chamberland… - … and mortality weekly …, 2020 - ncbi.nlm.nih.gov","… Less than 1 year after the SARS-CoV-2 genome was first sequenced, an application * for Emergency Use Authorization for a candidate vaccine has been filed with the Food and …",242,"https://scholar.google.com/scholar?cites=5125691806351849090&as_sdt=20005&sciodt=0,9&hl=en&num=20",5125691806351849090,13,"https://scholar.google.com/scholar?cluster=5125691806351849090&hl=en&num=20&as_sdt=0,9&as_ylo=2019",5125691806351849090,HTML,nih.gov,https://www.ncbi.nlm.nih.gov/pmc/articles/PMC7737687/
494,25,15,Html,A Framework for Equitable Allocation of COVID-19 Vaccine,https://www.ncbi.nlm.nih.gov/books/NBK564091/,-TkYS7JL2O8J,"B Kahn, L Brown, W Foege, H Gayle… - … of COVID-19 Vaccine, 2020 - ncbi.nlm.nih.gov",… that decisions about COVID-19 vaccine allocation must be made … COVID-19); the effectiveness of vaccines in tandem with existing preventive measures; public confidence in the vaccine…,69,"https://scholar.google.com/scholar?cites=17282646799170419193&as_sdt=20005&sciodt=0,9&hl=en&num=20",17282646799170419193,6,"https://scholar.google.com/scholar?cluster=17282646799170419193&hl=en&num=20&as_sdt=0,9&as_ylo=2019",17282646799170419193,HTML,nih.gov,https://www.ncbi.nlm.nih.gov/books/NBK564091/
495,25,16,Pdf,Allergic reactions to the first COVID-19 vaccine: a potential role of Polyethylene glycol,https://www.icpcovid.com/sites/default/files/2020-12/EP%2095%207%20C%20Allergic%20reactions%20to%20first%20COVIDS-19%20vaccine%20Role%20of%20PEG%20Cezmi%20Akdis%20Allergy%20Dec%202020.pdf,CcyscB_f5qMJ,"B Cabanillas, C Akdis, N Novak - Allergy, 2020 - icpcovid.com","… The COVID-19 vaccine developed by Pfizer and BioNTech … to approve a vaccine to prevent coronavirus disease (COVID-19)… The vaccine, named BNT162b2, is a messenger ribonucleic …",97,"https://scholar.google.com/scholar?cites=11810372398953057289&as_sdt=20005&sciodt=0,9&hl=en&num=20",11810372398953057289,8,"https://scholar.google.com/scholar?cluster=11810372398953057289&hl=en&num=20&as_sdt=0,9&as_ylo=2019",11810372398953057289,PDF,icpcovid.com,https://www.icpcovid.com/sites/default/files/2020-12/EP%2095%207%20C%20Allergic%20reactions%20to%20first%20COVIDS-19%20vaccine%20Role%20of%20PEG%20Cezmi%20Akdis%20Allergy%20Dec%202020.pdf
496,25,17,,COVID-19 vaccine trials in Africa,https://www.thelancet.com/journals/lanres/article/PIIS2213-2600(20)30401-X/fulltext,VTgOwvQNf0kJ,"M Makoni - The Lancet Respiratory Medicine, 2020 - thelancet.com","… the adoption of this NVX-CoV2373 vaccine candidate or other COVID-19 vaccines in African … , of a COVID-19 vaccine in South Africa commenced on June 23, which was the first vaccine …",35,"https://scholar.google.com/scholar?cites=5295967031689885781&as_sdt=20005&sciodt=0,9&hl=en&num=20",5295967031689885781,8,"https://scholar.google.com/scholar?cluster=5295967031689885781&hl=en&num=20&as_sdt=0,9&as_ylo=2019",5295967031689885781,HTML,nih.gov,https://www.ncbi.nlm.nih.gov/pmc/articles/pmc7831818/
497,25,18,Html,… group differences in engagement with COVID-19 vaccination programmes–at Pandemic Pace; when vaccine confidence in mass rollout meets local vaccine …,https://link.springer.com/article/10.1186/s13584-021-00467-9,HY7LORMy5NQJ,"JA Reid, MA Mabhala - Israel Journal of Health Policy Research, 2021 - Springer",… vaccine against COVID 19. The most successful countries in population vaccination against COVID … uptake of the COVID 19 vaccine is lower amongst these countries’ ethnic minorities. …,8,"https://scholar.google.com/scholar?cites=15340441288886160925&as_sdt=20005&sciodt=0,9&hl=en&num=20",15340441288886160925,15,"https://scholar.google.com/scholar?cluster=15340441288886160925&hl=en&num=20&as_sdt=0,9&as_ylo=2019",15340441288886160925,HTML,springer.com,https://link.springer.com/article/10.1186/s13584-021-00467-9
498,25,19,,Covid-19 vaccine trial protocols released,https://www.bmj.com/content/371/bmj.m4058,9u-SZEUOfRQJ,"P Doshi - bmj, 2020 - bmj.com","The ongoing phase III trials for covid-19 vaccines are some of the most consequential randomised trials ever done. In September, following months of campaigning for greater openness…",30,"https://scholar.google.com/scholar?cites=1476351944050274294&as_sdt=20005&sciodt=0,9&hl=en&num=20",1476351944050274294,8,"https://scholar.google.com/scholar?cluster=1476351944050274294&hl=en&num=20&as_sdt=0,9&as_ylo=2019",1476351944050274294,,,
499,25,20,Html,Equitable allocation of COVID-19 vaccines in the United States,https://www.nature.com/articles/s41591-021-01379-6,r4XiFkuiizUJ,"H Schmidt, R Weintraub, MA Williams, K Miller… - Nature Medicine, 2021 - nature.com","… Many vaccine rationing guidelines urge planners to … In this study, we analyzed vaccine allocation plans published by 8 … in combination with metrics such as COVID-19 incidence, and 37 …",38,"https://scholar.google.com/scholar?cites=3858355949163152815&as_sdt=20005&sciodt=0,9&hl=en&num=20",3858355949163152815,6,"https://scholar.google.com/scholar?cluster=3858355949163152815&hl=en&num=20&as_sdt=0,9&as_ylo=2019",3858355949163152815,HTML,nature.com,https://www.nature.com/articles/s41591-021-01379-6
500,26,1,Html,"The Advisory Committee on Immunization Practices' updated interim recommendation for allocation of COVID-19 vaccine—United States, December 2020",https://www.cdc.gov/mmwr/volumes/69/wr/mm695152e2.htm?s%5Fcid=mm695152e2%5Fw,O63ygU8pE8wJ,"K Dooling - MMWR. Morbidity and mortality weekly report, 2021 - cdc.gov","… ACIP’s recommendations for COVID-19 vaccine allocation are interim and might be … for new COVID-19 vaccines, changes in vaccine supply, or changes in COVID-19 epidemiology. …",263,"https://scholar.google.com/scholar?cites=14705142629754121531&as_sdt=20005&sciodt=0,9&hl=en&num=20",14705142629754121531,11,"https://scholar.google.com/scholar?cluster=14705142629754121531&hl=en&num=20&as_sdt=0,9&as_ylo=2019",14705142629754121531,HTML,cdc.gov,https://www.cdc.gov/mmwr/volumes/69/wr/mm695152e2.htm?s%5Fcid=mm695152e2%5Fw
501,26,2,,Willingness-to-pay for a COVID-19 vaccine and its associated determinants in Indonesia,https://www.tandfonline.com/doi/abs/10.1080/21645515.2020.1819741,kBVyLRbWs-UJ,"H Harapan, AL Wagner, A Yufika… - Human vaccines & …, 2020 - Taylor & Francis","… a COVID-19 vaccine. To evaluate WTP, it was hypothesized that a COVID-19 vaccine had … human and showed a 95% efficacy to prevent COVID-19 in nonimmune population with a 5% …",76,"https://scholar.google.com/scholar?cites=16551808446256780688&as_sdt=20005&sciodt=0,9&hl=en&num=20",16551808446256780688,10,"https://scholar.google.com/scholar?cluster=16551808446256780688&hl=en&num=20&as_sdt=0,9&as_ylo=2019",16551808446256780688,PDF,tandfonline.com,https://www.tandfonline.com/doi/pdf/10.1080/21645515.2020.1819741
502,26,3,,The environmental impact of mass coronavirus vaccinations: A point of view on huge COVID-19 vaccine waste across the globe during ongoing vaccine campaigns,https://www.sciencedirect.com/science/article/pii/S0048969721069576,rUFmeRmjnrMJ,"V Hasija, S Patial, P Raizada, S Thakur, P Singh… - Science of The Total …, 2022 - Elsevier","… This study aims to address the global impact of COVID-19 vaccine waste on the environment, their critical management and safe disposal which would definitely curb the further disease …",4,"https://scholar.google.com/scholar?cites=12942961708915638701&as_sdt=20005&sciodt=0,9&hl=en&num=20",12942961708915638701,6,"https://scholar.google.com/scholar?cluster=12942961708915638701&hl=en&num=20&as_sdt=0,9&as_ylo=2019",12942961708915638701,HTML,nih.gov,https://www.ncbi.nlm.nih.gov/pmc/articles/pmc8609666/
503,26,4,Html,Willingness to vaccinate against COVID-19 in the US: representative longitudinal evidence from April to October 2020,https://www.sciencedirect.com/science/article/pii/S074937972100088X,5cDKd4Ibt2sJ,"M Daly, E Robinson - American Journal of Preventive Medicine, 2021 - Elsevier","… effects of a COVID-19 vaccine were assessed (eg, I think the COVID-19 vaccine might cause … I think the COVID vaccine might cause lasting health problems for me. 43.6 56.4 26.6 73.4 …",66,"https://scholar.google.com/scholar?cites=7761702729965813989&as_sdt=20005&sciodt=0,9&hl=en&num=20",7761702729965813989,15,"https://scholar.google.com/scholar?cluster=7761702729965813989&hl=en&num=20&as_sdt=0,9&as_ylo=2019",7761702729965813989,HTML,sciencedirect.com,https://www.sciencedirect.com/science/article/pii/S074937972100088X
504,26,5,Html,Access to and equitable distribution of COVID-19 vaccine in low-income countries,https://www.nature.com/articles/s41541-021-00323-6,pPjvGDlXsPQJ,"KP Acharya, TR Ghimire, SH Subramanya - npj Vaccines, 2021 - nature.com",… to at least one COVID-19 vaccine. Gibraltar and Israel had more than 78 cumulative COVID-19 … gross domestic product had administered 75% of all COVID-19 vaccines 9 . Dr. Tedros …,50,"https://scholar.google.com/scholar?cites=17631688443898624164&as_sdt=20005&sciodt=0,9&hl=en&num=20",17631688443898624164,9,"https://scholar.google.com/scholar?cluster=17631688443898624164&hl=en&num=20&as_sdt=0,9&as_ylo=2019",17631688443898624164,HTML,nature.com,https://www.nature.com/articles/s41541-021-00323-6
505,26,6,,Current status of COVID‐19 (pre) clinical vaccine development,https://onlinelibrary.wiley.com/doi/abs/10.1002/anie.202008319,O1Qu5LB_PgoJ,"T Ye, Z Zhong, A García‐Sastre… - Angewandte Chemie …, 2020 - Wiley Online Library","… vaccine. Given the urgent need for a vaccine against COVID-19, so far over 200 vaccine … challenges regarding the current COVID-19 vaccine development endeavors and discuss …",43,"https://scholar.google.com/scholar?cites=738167786654553147&as_sdt=20005&sciodt=0,9&hl=en&num=20",738167786654553147,12,"https://scholar.google.com/scholar?cluster=738167786654553147&hl=en&num=20&as_sdt=0,9&as_ylo=2019",738167786654553147,PDF,ugent.be,https://biblio.ugent.be/publication/8680726/file/8680728.pdf
506,26,7,Html,Determinants of COVID-19 vaccine acceptance in a high infection-rate country: a cross-sectional study in Russia,https://scielo.isciii.es/scielo.php?script=sci_arttext&pid=S1885-642X2021000100016,KkyIqcfmVmgJ,"VD Tran, TV Pak, EI Gribkova, GA Galkina… - Pharmacy Practice …, 2021 - SciELO Espana","… , including 'I would only take the COVID-19 vaccine if mandatory vaccination is required at … against COVID-19 only if it was recommended by a trusted doctor', and 'The vaccine will help …",34,"https://scholar.google.com/scholar?cites=7518450373158784042&as_sdt=20005&sciodt=0,9&hl=en&num=20",7518450373158784042,23,"https://scholar.google.com/scholar?cluster=7518450373158784042&hl=en&num=20&as_sdt=0,9&as_ylo=2019",7518450373158784042,HTML,isciii.es,https://scielo.isciii.es/scielo.php?script=sci_arttext&pid=S1885-642X2021000100016
507,26,8,Html,Not just conspiracy theories: Vaccine opponents and proponents add to the COVID-19 'infodemic'on Twitter,https://www.ncbi.nlm.nih.gov/pmc/articles/pmc8345314/,AbJkTmU0A2UJ,"AM Jamison, DA Broniatowski, M Dredze… - Harvard Kennedy …, 2020 - ncbi.nlm.nih.gov","… We assessed content from the most active vaccine accounts on Twitter to understand how … vaccine opponents to share misleading information about COVID-19, we also found vaccine …",52,"https://scholar.google.com/scholar?cites=7278719032472416769&as_sdt=20005&sciodt=0,9&hl=en&num=20",7278719032472416769,12,"https://scholar.google.com/scholar?cluster=7278719032472416769&hl=en&num=20&as_sdt=0,9&as_ylo=2019",7278719032472416769,HTML,nih.gov,https://www.ncbi.nlm.nih.gov/pmc/articles/pmc8345314/
508,26,9,,COVID‐19 vaccine‐associated cerebral venous thrombosis in Germany,https://onlinelibrary.wiley.com/doi/abs/10.1002/ana.26172,1W51g1maQ8YJ,"JB Schulz, P Berlit, HC Diener, C Gerloff… - Annals of …, 2021 - Wiley Online Library",… Vaccine-induced CVTs are restricted to COVID-19 vaccination with ChAdOx1 and do not … with CVT after COVID-19 vaccination. 3. Patients with vaccine-induced CVT after COVID-19 …,55,"https://scholar.google.com/scholar?cites=14286432152197623509&as_sdt=20005&sciodt=0,9&hl=en&num=20",14286432152197623509,9,"https://scholar.google.com/scholar?cluster=14286432152197623509&hl=en&num=20&as_sdt=0,9&as_ylo=2019",14286432152197623509,PDF,wiley.com,https://onlinelibrary.wiley.com/doi/pdf/10.1002/ana.26172
509,26,10,Html,An uncertain public—encouraging acceptance of Covid-19 vaccines,https://www.nejm.org/doi/full/10.1056/NEJMp2100351,3-3ku5FyyBUJ,"GK SteelFisher, RJ Blendon… - New England Journal of …, 2021 - Mass Medical Soc",… with other research on Covid vaccine uptake in the United … reasons for hesitancy regarding Covid-19 vaccination cited in … companies to provide Covid-19 vaccine information: as few as …,41,"https://scholar.google.com/scholar?cites=1569630440386784735&as_sdt=20005&sciodt=0,9&hl=en&num=20",1569630440386784735,5,"https://scholar.google.com/scholar?cluster=1569630440386784735&hl=en&num=20&as_sdt=0,9&as_ylo=2019",1569630440386784735,HTML,nejm.org,https://www.nejm.org/doi/full/10.1056/NEJMp2100351
510,26,11,,The French public's attitudes to a future COVID-19 vaccine: The politicization of a public health issue,https://www.sciencedirect.com/science/article/pii/S027795362030633X,UiBoUO8KetUJ,"JK Ward, C Alleaume, P Peretti-Watel, V Seror… - Social science & …, 2020 - Elsevier","… vaccine will be available, will it be widely used? In countries where vaccine hesitancy was widespread before the COVID… get vaccinated if a vaccine against the COVID-19 was available…",189,"https://scholar.google.com/scholar?cites=15382619500199813202&as_sdt=20005&sciodt=0,9&hl=en&num=20",15382619500199813202,20,"https://scholar.google.com/scholar?cluster=15382619500199813202&hl=en&num=20&as_sdt=0,9&as_ylo=2019",15382619500199813202,PDF,sciencedirect.com,https://www.sciencedirect.com/science/article/am/pii/S027795362030633X
511,26,12,Html,Efficient maternal to neonatal transfer of antibodies against SARS-CoV-2 and BNT162b2 mRNA COVID-19 vaccine,https://www.jci.org/articles/view/150319?elqTrackId=9f9b091c7be14f0dbe31bcce84fc2434,b2Gxz7PtupQJ,"O Beharier, RP Mayo, T Raz, KN Sacks… - The Journal of …, 2021 - Am Soc Clin Investig","… with the mRNA vaccine. We found that the Pfizer-BioNTech COVID-19 mRNA vaccine elicits a … following the first vaccine dose. Hence, our data deliver convincing proof for the potency of …",92,"https://scholar.google.com/scholar?cites=10717139619820953967&as_sdt=20005&sciodt=0,9&hl=en&num=20",10717139619820953967,19,"https://scholar.google.com/scholar?cluster=10717139619820953967&hl=en&num=20&as_sdt=0,9&as_ylo=2019",10717139619820953967,HTML,jci.org,https://www.jci.org/articles/view/150319?elqTrackId=9f9b091c7be14f0dbe31bcce84fc2434
512,26,13,,Factors associated with parents' willingness to enroll their children in trials for COVID-19 vaccination,https://www.tandfonline.com/doi/abs/10.1080/21645515.2020.1834325,Pz5z0uDanQsJ,"RD Goldman, G Staubli, CP Cotanda… - Human vaccines & …, 2021 - Taylor & Francis","… Parental interest in participation, history of vaccinating their child, and the child being older all are associated with parents allowing their child to participate in a COVID vaccine trial. This …",26,"https://scholar.google.com/scholar?cites=837065764899077695&as_sdt=20005&sciodt=0,9&hl=en&num=20",837065764899077695,9,"https://scholar.google.com/scholar?cluster=837065764899077695&hl=en&num=20&as_sdt=0,9&as_ylo=2019",837065764899077695,PDF,tandfonline.com,https://www.tandfonline.com/doi/pdf/10.1080/21645515.2020.1834325
513,26,14,Html,Environmental friendly micro cold storage for last-mile Covid-19 vaccine logistics,https://link.springer.com/article/10.1007/s11356-021-17584-2,Cag7-t8fH5oJ,"LPR Nadimuthu, K Victor - Environmental Science and Pollution Research, 2022 - Springer","… has received the first dose of Covid-19 vaccination, and 23.7% … Covid-19 vaccine, and 8.8% of the people are wholly vaccinated (Our World in Data 2021). The administration of Covid-…",4,"https://scholar.google.com/scholar?cites=11105630252955314185&as_sdt=20005&sciodt=0,9&hl=en&num=20",11105630252955314185,5,"https://scholar.google.com/scholar?cluster=11105630252955314185&hl=en&num=20&as_sdt=0,9&as_ylo=2019",11105630252955314185,HTML,springer.com,https://link.springer.com/article/10.1007/s11356-021-17584-2
514,26,15,,Acute myocarditis after administration of the BNT162b2 vaccine against COVID-19,https://europepmc.org/article/med/33776190?fbclid=iwar2zyryvbms9np6knogpshhhlve8qpgswfznurewtqv3mav5rrfbu5qhccw&client=bot,Ixvv8EtmBKYJ,"B García, P Ortega, BF JA, C León… - Revista espanola de …, 2021 - europepmc.org","Las reacciones adversas a las vacunas son generalmente banales, pero se han descrito casos de miopericarditis tras su aplicación 1. Por otro lado, se han publicado recientemente …",73,"https://scholar.google.com/scholar?cites=11962798986553662243&as_sdt=20005&sciodt=0,9&hl=en&num=20",11962798986553662243,6,"https://scholar.google.com/scholar?cluster=11962798986553662243&hl=en&num=20&as_sdt=0,9&as_ylo=2019",11962798986553662243,,,
515,26,16,Html,Quantifying early COVID-19 outbreak transmission in South Africa and exploring vaccine efficacy scenarios,https://journals.plos.org/plosone/article?id=10.1371/journal.pone.0236003,tteLWqdv8-UJ,"Z Mukandavire, F Nyabadza, NJ Malunguza… - PloS one, 2020 - journals.plos.org",… show that COVID-19 … vaccine with 70% efficacy had the capacity to contain COVID-19 outbreak but at very higher vaccination coverage 94.44% (95% Crl 92.44–99.92%) with a vaccine …,61,"https://scholar.google.com/scholar?cites=16569710218595522486&as_sdt=20005&sciodt=0,9&hl=en&num=20",16569710218595522486,28,"https://scholar.google.com/scholar?cluster=16569710218595522486&hl=en&num=20&as_sdt=0,9&as_ylo=2019",16569710218595522486,HTML,plos.org,https://journals.plos.org/plosone/article?id=10.1371/journal.pone.0236003
516,26,17,,Efficacy and safety of a COVID-19 inactivated vaccine in healthcare professionals in Brazil: the PROFISCOV study,https://papers.ssrn.com/sol3/papers.cfm?abstract_id=3822780,hW2LJ9boeqkJ,"R Palacios, AP Batista, CSN Albuquerque, EG Patiño… - 2021 - papers.ssrn.com",… Participants received two doses of vaccine (3 μg in 0.5 mL) vaccine or placebo at day 0 and … COVID-19 cases confirmed by RT-PCR 14 days after the second dose of the vaccine. …,101,"https://scholar.google.com/scholar?cites=12212329346052615557&as_sdt=20005&sciodt=0,9&hl=en&num=20",12212329346052615557,6,"https://scholar.google.com/scholar?cluster=12212329346052615557&hl=en&num=20&as_sdt=0,9&as_ylo=2019",12212329346052615557,PDF,poder360.com.br,https://static.poder360.com.br/2021/04/estudo-preliminar-coronavac-11.abr_.2021.pdf
517,26,18,,Why is India having a covid-19 surge?,https://www.bmj.com/content/373/bmj.n1124.short,d4lyCkKwLhsJ,K Thiagarajan - 2021 - bmj.com,"… After the first wave people dropped their guard, said Chandrakant Lahariya, an epidemiologist who helped write India’s national covid vaccine policy. “In some of the most badly hit …",68,"https://scholar.google.com/scholar?cites=1958696685642353015&as_sdt=20005&sciodt=0,9&hl=en&num=20",1958696685642353015,8,"https://scholar.google.com/scholar?cluster=1958696685642353015&hl=en&num=20&as_sdt=0,9&as_ylo=2019",1958696685642353015,PDF,researchgate.net,https://www.researchgate.net/profile/Kamala-Thiagarajan-2/publication/351273550_Why_is_India_having_a_covid-19_surge/links/60a252e545851528ebed97f5/Why-is-India-having-a-covid-19-surge.pdf
518,26,19,Html,Artificial intelligence for COVID-19 drug discovery and vaccine development,https://www.frontiersin.org/articles/10.3389/frai.2020.00065/full,SRh1dMoexAkJ,"A Keshavarzi Arshadi, J Webb, M Salem… - Frontiers in Artificial …, 2020 - frontiersin.org",… for a drug or vaccine candidate by identifying … of COVID-19 drug and vaccine development using artificial intelligence and the potential of intelligent training for the discovery of COVID-…,102,"https://scholar.google.com/scholar?cites=703721296662698057&as_sdt=20005&sciodt=0,9&hl=en&num=20",703721296662698057,12,"https://scholar.google.com/scholar?cluster=703721296662698057&hl=en&num=20&as_sdt=0,9&as_ylo=2019",703721296662698057,HTML,frontiersin.org,https://www.frontiersin.org/articles/10.3389/frai.2020.00065/full
519,26,20,,Heterologous prime-boost: breaking the protective immune response bottleneck of COVID-19 vaccine candidates,https://www.tandfonline.com/doi/abs/10.1080/22221751.2021.1902245,j2rw4RE8eX8J,"Q He, Q Mao, C An, J Zhang, F Gao, L Bian… - Emerging microbes & …, 2021 - Taylor & Francis","… vaccine development for the containment of COVID-19. So far, there are 60 vaccine … Although several leading COVID-19 vaccines have been shown to confer protection against …",74,"https://scholar.google.com/scholar?cites=9185438962501577359&as_sdt=20005&sciodt=0,9&hl=en&num=20",9185438962501577359,12,"https://scholar.google.com/scholar?cluster=9185438962501577359&hl=en&num=20&as_sdt=0,9&as_ylo=2019",9185438962501577359,PDF,tandfonline.com,https://www.tandfonline.com/doi/pdf/10.1080/22221751.2021.1902245?needAccess=true&
520,27,1,,Lottery-based incentive in Ohio and COVID-19 vaccination rates,https://jamanetwork.com/journals/jama/article-abstract/2781792,1vVbo8yfDw4J,"AJ Walkey, A Law, NA Bosch - Jama, 2021 - jamanetwork.com",… We used data from the Centers for Disease Control and Prevention COVID-19 Vaccine Tracker 4 to identify daily first dose administration of the COVID-19 vaccine in adults aged 18 …,40,"https://scholar.google.com/scholar?cites=1013204142444508630&as_sdt=20005&sciodt=0,9&hl=en&num=20",1013204142444508630,6,"https://scholar.google.com/scholar?cluster=1013204142444508630&hl=en&num=20&as_sdt=0,9&as_ylo=2019",1013204142444508630,HTML,jamanetwork.com,https://jamanetwork.com/journals/jama/fullarticle/2781792
521,27,2,,COVID-19 vaccine equity: a health systems and policy perspective,https://www.tandfonline.com/doi/abs/10.1080/14760584.2022.2004125,YpArVqaeCGcJ,"R Van De Pas, MA Widdowson, R Ravinetto… - Expert review of …, 2022 - Taylor & Francis","… , including the current COVID-19 vaccination drive, and … COVID-19 vaccine deployment in some countries from different continents. It recommends that the international Access to COVID…",5,"https://scholar.google.com/scholar?cites=7424358422967717986&as_sdt=20005&sciodt=0,9&hl=en&num=20",7424358422967717986,9,"https://scholar.google.com/scholar?cluster=7424358422967717986&hl=en&num=20&as_sdt=0,9&as_ylo=2019",7424358422967717986,PDF,tandfonline.com,https://www.tandfonline.com/doi/pdf/10.1080/14760584.2022.2004125
