,page_number,position,result_type,title,link,result_id,publication_info_summary,snippet,cited_by_count,cited_by_link,cited_by_id,total_versions,all_versions_link,all_versions_id,file_format,file_title,file_link
715,36,16,,"Central obesity, smoking habit, and hypertension are associated with lower antibody titres in response to COVID‐19 mRNA vaccine",https://onlinelibrary.wiley.com/doi/abs/10.1002/dmrr.3465,dl-OxX1WfXwJ,"M Watanabe, A Balena, D Tuccinardi… - Diabetes/metabolism …, 2022 - Wiley Online Library","… vaccine in relation to body composition and body fat distribution. In Italy, the BNT162b2 Pfizer BioNtech vaccine … the response to the COVID‐19 vaccine and adiposity parameters such …",71,"https://scholar.google.com/scholar?cites=8970421130977238902&as_sdt=20005&sciodt=0,9&hl=en&num=20",8970421130977238902,16,"https://scholar.google.com/scholar?cluster=8970421130977238902&hl=en&num=20&as_sdt=0,9&as_ylo=2019",8970421130977238902,PDF,wiley.com,https://onlinelibrary.wiley.com/doi/pdf/10.1002/dmrr.3465
716,36,17,,The rush to create a covid-19 vaccine may do more harm than good,https://www.bmj.com/content/370/bmj.m3209.short,DBfzyL5p36UJ,"E Torreele - bmj, 2020 - bmj.com","… By setting the performance bar far lower in covid-19 vaccine development than what would otherwise be acceptable, we are also unwittingly redefining the concept of a vaccine—from a …",34,"https://scholar.google.com/scholar?cites=11952388204200662796&as_sdt=20005&sciodt=0,9&hl=en&num=20",11952388204200662796,6,"https://scholar.google.com/scholar?cluster=11952388204200662796&hl=en&num=20&as_sdt=0,9&as_ylo=2019",11952388204200662796,,,
717,36,18,,Vaccine Development against COVID-19: Study from Pre-Clinical Phases to Clinical Trials and Global Use,https://www.mdpi.com/1209388,UTh6SUy-NbYJ,"S Ahmed, S Khan, I Imran, FA Mughairbi, FS Sheikh… - Vaccines, 2021 - mdpi.com","… The vaccine was recently approved by US regulators. Moderna, Inc., a biotechnology … study of this vaccine called mRNA-1273 against COVID-19. Within animal models, the vaccine has …",5,"https://scholar.google.com/scholar?cites=13129609523528087633&as_sdt=20005&sciodt=0,9&hl=en&num=20",13129609523528087633,10,"https://scholar.google.com/scholar?cluster=13129609523528087633&hl=en&num=20&as_sdt=0,9&as_ylo=2019",13129609523528087633,PDF,mdpi.com,https://www.mdpi.com/2076-393X/9/8/836/pdf
718,36,19,Html,Safe and effective two-in-one replicon-and-VLP minispike vaccine for COVID-19: Protection of mice after a single immunization,https://journals.plos.org/plospathogens/article?id=10.1371/journal.ppat.1009064,IN7QuNPrdz4J,"AA Hennrich, B Sawatsky, R Santos-Mandujano… - PLoS …, 2021 - journals.plos.org","… COVID-19 vaccine candidates but can induce non-neutralizing antibodies, which might cause vaccination-induced complications or enhancement of COVID… replicon vaccine platform for …",9,"https://scholar.google.com/scholar?cites=4501325647151423008&as_sdt=20005&sciodt=0,9&hl=en&num=20",4501325647151423008,16,"https://scholar.google.com/scholar?cluster=4501325647151423008&hl=en&num=20&as_sdt=0,9&as_ylo=2019",4501325647151423008,HTML,plos.org,https://journals.plos.org/plospathogens/article?id=10.1371/journal.ppat.1009064
719,36,20,,Immunogenicity and safety of the BNT162b2 mRNA COVID-19 vaccine among actively treated cancer patients,https://academic.oup.com/jnci/article-abstract/114/2/203/6359210,Rlmp_olTNd0J,"H Ligumsky, E Safadi, T Etan, N Vaknin… - JNCI: Journal of the …, 2022 - academic.oup.com",Background Activity and safety of the SARS-CoV-2 BNT162b2 vaccine in actively treated patients with solid tumors is currently unknown. Methods We conducted a retrospective study of …,23,"https://scholar.google.com/scholar?cites=15939738308295874886&as_sdt=20005&sciodt=0,9&hl=en&num=20",15939738308295874886,7,"https://scholar.google.com/scholar?cluster=15939738308295874886&hl=en&num=20&as_sdt=0,9&as_ylo=2019",15939738308295874886,,,
720,37,1,,Factors associated with US adults' likelihood of accepting COVID-19 vaccination,https://jamanetwork.com/journals/jamanetworkopen/article-abstract/2771872,KLnROh1zhqYJ,"S Kreps, S Prasad, JS Brownstein, Y Hswen… - JAMA network …, 2020 - jamanetwork.com",… coronavirus disease 2019 (COVID-19) vaccine. The average … to receive a hypothetical COVID-19 vaccine. Estimates are … to address vaccine hesitancy when a COVID-19 vaccine …,417,"https://scholar.google.com/scholar?cites=11999404826553334056&as_sdt=20005&sciodt=0,9&hl=en&num=20",11999404826553334056,10,"https://scholar.google.com/scholar?cluster=11999404826553334056&hl=en&num=20&as_sdt=0,9&as_ylo=2019",11999404826553334056,HTML,jamanetwork.com,https://jamanetwork.com/journals/jamanetworkopen/fullarticle/2771872
721,37,2,Html,Frontier therapeutics and vaccine strategies for sars-cov-2 (COVID-19): A review,https://www.ncbi.nlm.nih.gov/pmc/articles/PMC8266011/,WXlItqVHC4oJ,"A Sheikhshahrokh, R Ranjbar, E Saeidi… - Iranian Journal of …, 2020 - ncbi.nlm.nih.gov","COVID-19 is considered as the third human coronavirus and has a high potential for transmission. Fast public health interventions through antibodies, anti-virals or novel vaccine …",45,"https://scholar.google.com/scholar?cites=9947122979031251289&as_sdt=20005&sciodt=0,9&hl=en&num=20",9947122979031251289,21,"https://scholar.google.com/scholar?cluster=9947122979031251289&hl=en&num=20&as_sdt=0,9&as_ylo=2019",9947122979031251289,HTML,nih.gov,https://www.ncbi.nlm.nih.gov/pmc/articles/PMC8266011/
722,37,3,Html,Effectiveness of the CoronaVac vaccine in the elderly population during a P. 1 variant-associated epidemic of COVID-19 in Brazil: A test-negative case-control …,https://www.medrxiv.org/content/10.1101/2021.05.19.21257472.abstract,CP3SAxdTPLwJ,"OT Ranzani, M Hitchings, M Dorion, TL D'Agostini… - medrxiv, 2021 - medrxiv.org","… -virus vaccine, CoronaVac, against symptomatic COVID-19 in … We identified RT-PCR-confirmed COVID-19 cases as well as … COVID-19 status, and date of RT-PCR testing. We estimated …",32,"https://scholar.google.com/scholar?cites=13563807536046603528&as_sdt=20005&sciodt=0,9&hl=en&num=20",13563807536046603528,9,"https://scholar.google.com/scholar?cluster=13563807536046603528&hl=en&num=20&as_sdt=0,9&as_ylo=2019",13563807536046603528,HTML,medrxiv.org,https://www.medrxiv.org/content/10.1101/2021.05.19.21257472.abstract
723,37,4,,Age and frailty in COVID-19 vaccine development,https://www.thelancet.com/journals/lancet/article/PIIS0140-6736(20)32481-8/fulltext,sKAdJO2H43QJ,"MK Andrew, JE McElhaney - The Lancet, 2020 - thelancet.com","… board for a COVID-19 vaccine trial funded by … to vaccine development outside of COVID-19, and personal fees for serving on the Scientific Advisory Board for an influenza vaccine trial …",31,"https://scholar.google.com/scholar?cites=8422725180695879856&as_sdt=20005&sciodt=0,9&hl=en&num=20",8422725180695879856,9,"https://scholar.google.com/scholar?cluster=8422725180695879856&hl=en&num=20&as_sdt=0,9&as_ylo=2019",8422725180695879856,HTML,nih.gov,https://www.ncbi.nlm.nih.gov/pmc/articles/pmc7674981/
724,37,5,,Covid-19: WHO warns against “vaccine nationalism” or face further virus mutations,https://www.bmj.com/content/372/bmj.n292,_P4EV0zdoN0J,L Eaton - 2021 - bmj.com,"… , commenting on the vaccine row in Europe. “We all need to ask ourselves, ‘would I have the vaccine if I thought it meant a health worker in the south wouldn’t get that vaccine today?’ …",46,"https://scholar.google.com/scholar?cites=15970007598602977020&as_sdt=20005&sciodt=0,9&hl=en&num=20",15970007598602977020,7,"https://scholar.google.com/scholar?cluster=15970007598602977020&hl=en&num=20&as_sdt=0,9&as_ylo=2019",15970007598602977020,,,
725,37,6,Html,Antibody response to mRNA-1273 SARS-CoV-2 vaccine in hemodialysis patients with and without prior COVID-19,https://cjasn.asnjournals.org/content/16/8/1258?utm_campaign=TMDPC&WT.MC_ID=TMDPC&utm_medium=cpc&utm_source=TrendMD,Mjbkv4ipnlIJ,"L Chan, N Fuca, E Zeldis, KN Campbell… - Clinical Journal of the …, 2021 - Am Soc Nephrol","… ) were diagnosed with COVID-19 prior to their first vaccine dose, and … COVID-19 1 week after the first vaccine dose. Patient characteristics by COVID-19 status at the time of first vaccine …",29,"https://scholar.google.com/scholar?cites=5953382162230425138&as_sdt=20005&sciodt=0,9&hl=en&num=20",5953382162230425138,6,"https://scholar.google.com/scholar?cluster=5953382162230425138&hl=en&num=20&as_sdt=0,9&as_ylo=2019",5953382162230425138,HTML,asnjournals.org,https://cjasn.asnjournals.org/content/16/8/1258?utm_campaign=TMDPC&WT.MC_ID=TMDPC&utm_medium=cpc&utm_source=TrendMD
726,37,7,Html,Polyethylene glycol (PEG) is a cause of anaphylaxis to the Pfizer/BioNTech mRNA COVID‐19 vaccine,https://www.ncbi.nlm.nih.gov/pmc/articles/pmc8251011/,117JYgEGR7wJ,"P Sellaturay, S Nasser, S Islam… - Clinical and …, 2021 - ncbi.nlm.nih.gov","… (COVID‐19) vaccine, there were reports of 2 cases of anaphylaxis within minutes of administration of the Pfizer/BioNTech messenger RNA (mRNA) vaccine and … access to the vaccine, 2 …",97,"https://scholar.google.com/scholar?cites=13566819005499006679&as_sdt=20005&sciodt=0,9&hl=en&num=20",13566819005499006679,7,"https://scholar.google.com/scholar?cluster=13566819005499006679&hl=en&num=20&as_sdt=0,9&as_ylo=2019",13566819005499006679,HTML,nih.gov,https://www.ncbi.nlm.nih.gov/pmc/articles/pmc8251011/
727,37,8,Html,Predicting intention to receive COVID-19 vaccine among the general population using the health belief model and the theory of planned behavior model,https://bmcpublichealth.biomedcentral.com/articles/10.1186/s12889-021-10816-7,NxT6EqFasQ4J,"L Shmueli - BMC Public Health, 2021 - bmcpublichealth.biomedcentral.com","… vaccine in the previous year (OR = 3.31, 95% CI 1.22–9.00) stated higher intention to receive COVID-19 vaccine. … higher levels of perceived benefits of COVID-19 vaccine (OR = 4.49, 95…",101,"https://scholar.google.com/scholar?cites=1058727035263390775&as_sdt=20005&sciodt=0,9&hl=en&num=20",1058727035263390775,20,"https://scholar.google.com/scholar?cluster=1058727035263390775&hl=en&num=20&as_sdt=0,9&as_ylo=2019",1058727035263390775,HTML,biomedcentral.com,https://bmcpublichealth.biomedcentral.com/articles/10.1186/s12889-021-10816-7
728,37,9,Html,BNT162b2 mRNA COVID-19 vaccine: First approval,https://link.springer.com/article/10.1007/s40265-021-01480-7,0DUja6SD3jwJ,"YN Lamb - Drugs, 2021 - Springer","… BNT162b2 (Comirnaty ® ; BioNTech and Pfizer) is a lipid nanoparticle-formulated, nucleoside-modified mRNA vaccine for the prevention of the novel coronavirus disease 2019 …",94,"https://scholar.google.com/scholar?cites=4386087829300786640&as_sdt=20005&sciodt=0,9&hl=en&num=20",4386087829300786640,9,"https://scholar.google.com/scholar?cluster=4386087829300786640&hl=en&num=20&as_sdt=0,9&as_ylo=2019",4386087829300786640,HTML,springer.com,https://link.springer.com/article/10.1007/s40265-021-01480-7
729,37,10,,Covid-19: Oxford researchers halt vaccine trial while adverse reaction is investigated,https://www.bmj.com/content/370/bmj.m3525.full,iI9vIZhpdCwJ,E Mahase - 2020 - bmj.com,One of the leading covid-19 vaccine candidate trials has been voluntarily paused as part of a standard review process triggered by a “single event of an unexplained illness that …,30,"https://scholar.google.com/scholar?cites=3203301337084170120&as_sdt=20005&sciodt=0,9&hl=en&num=20",3203301337084170120,7,"https://scholar.google.com/scholar?cluster=3203301337084170120&hl=en&num=20&as_sdt=0,9&as_ylo=2019",3203301337084170120,,,
730,37,11,,Estimating real-world COVID-19 vaccine effectiveness in Israel using aggregated counts,https://www.medrxiv.org/content/10.1101/2021.02.05.21251139.abstract,fsPImnkQtUoJ,"D Aran - MedRxiv, 2021 - medrxiv.org","… Here, using publicly available data of COVID-19 dynamics and SARS-CoV2 positive and … of the vaccine in reducing cases, hospitalizations and severe cases due to COVID-19. All data …",36,"https://scholar.google.com/scholar?cites=5383227044065231742&as_sdt=20005&sciodt=0,9&hl=en&num=20",5383227044065231742,8,"https://scholar.google.com/scholar?cluster=5383227044065231742&hl=en&num=20&as_sdt=0,9&as_ylo=2019",5383227044065231742,PDF,medrxiv.org,https://www.medrxiv.org/content/medrxiv/early/2021/02/19/2021.02.05.21251139.full.pdf
731,37,12,,Efficacy of a third BNT162b2 mRNA COVID-19 vaccine dose in patients with CLL who failed standard 2-dose vaccination,https://ashpublications.org/blood/article-abstract/139/5/678/482889,qQU9gwkZF3oJ,"Y Herishanu, G Rahav, S Levi… - Blood, The Journal …, 2022 - ashpublications.org","… of mRNA-1273 COVID-19 vaccine to organ-… vaccine dose. In the light of these findings, we decided to evaluate the serologic response to a third BNT162b2 mRNA COVID-19 vaccine in …",16,"https://scholar.google.com/scholar?cites=8797527925738767785&as_sdt=20005&sciodt=0,9&hl=en&num=20",8797527925738767785,8,"https://scholar.google.com/scholar?cluster=8797527925738767785&hl=en&num=20&as_sdt=0,9&as_ylo=2019",8797527925738767785,HTML,europepmc.org,https://europepmc.org/articles/pmc8648353/bin/mmc1.pdf
732,37,13,,COVID-19 vaccine acceptance among high-risk populations in Uganda,https://journals.sagepub.com/doi/abs/10.1177/20499361211024376,CZ2NhOPL9hkJ,"F Bongomin, R Olum, I Andia-Biraro… - Therapeutic …, 2021 - journals.sagepub.com","… for the acceptability of COVID-19 vaccine among persons at high risk of COVID-19 morbidity … receive the vaccine. Perceived risk of future COVID-19, extent of worrying about COVID-19, …",10,"https://scholar.google.com/scholar?cites=1870906873260907785&as_sdt=20005&sciodt=0,9&hl=en&num=20",1870906873260907785,8,"https://scholar.google.com/scholar?cluster=1870906873260907785&hl=en&num=20&as_sdt=0,9&as_ylo=2019",1870906873260907785,PDF,sagepub.com,https://journals.sagepub.com/doi/pdf/10.1177/20499361211024376
733,37,14,Pdf,Efficacy of the NVX-CoV2373 Covid-19 vaccine against the B. 1.1. 7 variant,https://sostelemedicina.ucv.ve/covid19/manuales/Eficacia%20de%20la%20vacuna%20NVX-CoV2373%20COVID-19%20frente%20a%20la%20variante%20B.1.1.7.pdf,QIBAHlM6dqAJ,"PT Heath, EP Galiza, DN Baxter, M Boffito… - …, 2021 - sostelemedicina.ucv.ve","… patients with Covid-19 in … Covid-19, resulting in further health and socioeconomic devastation. Early clinical data from the SARS-CoV-2 recombinant nanoparticle spike protein vaccine …",17,"https://scholar.google.com/scholar?cites=11562493221984567360&as_sdt=20005&sciodt=0,9&hl=en&num=20",11562493221984567360,3,"https://scholar.google.com/scholar?cluster=11562493221984567360&hl=en&num=20&as_sdt=0,9&as_ylo=2019",11562493221984567360,PDF,ucv.ve,https://sostelemedicina.ucv.ve/covid19/manuales/Eficacia%20de%20la%20vacuna%20NVX-CoV2373%20COVID-19%20frente%20a%20la%20variante%20B.1.1.7.pdf
734,37,15,Html,Advances in COVID-19 mRNA vaccine development,https://www.nature.com/articles/s41392-022-00950-y,7sbYpFsiqjMJ,"E Fang, X Liu, M Li, Z Zhang, L Song, B Zhu… - … and Targeted Therapy, 2022 - nature.com","… The mRNA vaccine is the first batch of COVID-19 vaccine candidates in clinical trials. As of February 8, 2022, WHO reported 337 COVID-19 vaccine candidates currently under …",1,"https://scholar.google.com/scholar?cites=3722825818978174702&as_sdt=20005&sciodt=0,9&hl=en&num=20",3722825818978174702,5,"https://scholar.google.com/scholar?cluster=3722825818978174702&hl=en&num=20&as_sdt=0,9&as_ylo=2019",3722825818978174702,HTML,nature.com,https://www.nature.com/articles/s41392-022-00950-y
735,37,16,Html,Placebo use and unblinding in COVID-19 vaccine trials: recommendations of a WHO Expert Working Group,https://www.nature.com/articles/s41591-021-01299-5,XK6-8CfMmJkJ,"JA Singh, S Kochhar, J Wolff - Nature medicine, 2021 - nature.com","… 2019 (COVID-19) has spurred an unprecedented accelerated approach to vaccine research … Currently, hundreds of thousands of participants globally are enrolled in COVID-19 vaccine …",7,"https://scholar.google.com/scholar?cites=11067820556177813084&as_sdt=20005&sciodt=0,9&hl=en&num=20",11067820556177813084,5,"https://scholar.google.com/scholar?cluster=11067820556177813084&hl=en&num=20&as_sdt=0,9&as_ylo=2019",11067820556177813084,HTML,nature.com,https://www.nature.com/articles/s41591-021-01299-5
736,37,17,,"COVID‐19: Current knowledge in clinical features, immunological responses, and vaccine development",https://faseb.onlinelibrary.wiley.com/doi/abs/10.1096/fj.202002662R,iU6DGn4iOgUJ,"R Singh, A Kang, X Luo, M Jeyanathan… - The FASEB …, 2021 - Wiley Online Library","… than 200 vaccine candidates … COVID-19 vaccine trials, indicating high protective efficacies by two mRNA vaccines (Moderna & Pfizer) and one chimpanzee adenoviral-vectored vaccine (…",53,"https://scholar.google.com/scholar?cites=376651443844894345&as_sdt=20005&sciodt=0,9&hl=en&num=20",376651443844894345,7,"https://scholar.google.com/scholar?cluster=376651443844894345&hl=en&num=20&as_sdt=0,9&as_ylo=2019",376651443844894345,PDF,wiley.com,https://faseb.onlinelibrary.wiley.com/doi/pdf/10.1096/fj.202002662R
737,37,18,Pdf,COVID-19 vaccine and Guillain-Barré syndrome: let's not leap to associations,https://discovery.ucl.ac.uk/id/eprint/10118239/1/Lunn_COVID%20vaccine%20v11.3%20clean.pdf,U6jf2Li3cG4J,"MP Lunn, DR Cornblath, BC Jacobs, L Querol… - Brain, 2020 - discovery.ucl.ac.uk",… associated GBS and a rate of 47.9 cases of GBS per 100000 COVID-19 … COVID19 for the same period makes the COVID-19 associated rate a maximum of 4.7 cases per 100000 COVID …,64,"https://scholar.google.com/scholar?cites=7958062546104068179&as_sdt=20005&sciodt=0,9&hl=en&num=20",7958062546104068179,9,"https://scholar.google.com/scholar?cluster=7958062546104068179&hl=en&num=20&as_sdt=0,9&as_ylo=2019",7958062546104068179,PDF,ucl.ac.uk,https://discovery.ucl.ac.uk/id/eprint/10118239/1/Lunn_COVID%20vaccine%20v11.3%20clean.pdf
738,37,19,,Factors associated with COVID-19 vaccine hesitancy among people with epilepsy in Lithuania,https://www.mdpi.com/1660-4601/18/8/4374,HVFf3mMkVfUJ,"K Puteikis, R Mameniškienė - International journal of environmental …, 2021 - mdpi.com","… Despite widespread mediatization of the successful development of COVID-19 … vaccine against COVID-19, especially because of doubts of its safety and efficacy. The speed of vaccine …",16,"https://scholar.google.com/scholar?cites=17678075923663900957&as_sdt=20005&sciodt=0,9&hl=en&num=20",17678075923663900957,11,"https://scholar.google.com/scholar?cluster=17678075923663900957&hl=en&num=20&as_sdt=0,9&as_ylo=2019",17678075923663900957,PDF,mdpi.com,https://www.mdpi.com/1660-4601/18/8/4374/pdf
739,37,20,Html,COVID-19 air travel restrictions and vaccine passports: An ongoing debate,https://www.ncbi.nlm.nih.gov/pmc/articles/PMC8056875/,0M8eu400ux4J,"ZA Memish, A Alharthy, SA Alqahtani… - Travel Medicine and …, 2021 - ncbi.nlm.nih.gov","… 2 is the use of vaccine passports or other such documentation… The concept of using COVID-19 vaccine passports based on … for the immunity that a vaccine passport would imply, nor to …",11,"https://scholar.google.com/scholar?cites=2214421425117122512&as_sdt=20005&sciodt=0,9&hl=en&num=20",2214421425117122512,7,"https://scholar.google.com/scholar?cluster=2214421425117122512&hl=en&num=20&as_sdt=0,9&as_ylo=2019",2214421425117122512,HTML,nih.gov,https://www.ncbi.nlm.nih.gov/pmc/articles/PMC8056875/
740,38,1,,The longest month: Analyzing covid-19 vaccination opinions dynamics from tweets in the month following the first vaccine announcement,https://ieeexplore.ieee.org/abstract/document/9354776/,aZFoHSh6c14J,"LA Cotfas, C Delcea, I Roxin, C Ioanăş… - IEEE …, 2021 - ieeexplore.ieee.org","… On November 9, 2020, when the first vaccine with more than 90% effective rate has been … COVID-19 vaccination by considering the one-month period following the first vaccine …",28,"https://scholar.google.com/scholar?cites=6805917774597624169&as_sdt=20005&sciodt=0,9&hl=en&num=20",6805917774597624169,7,"https://scholar.google.com/scholar?cluster=6805917774597624169&hl=en&num=20&as_sdt=0,9&as_ylo=2019",6805917774597624169,PDF,ieee.org,https://ieeexplore.ieee.org/iel7/6287639/9312710/09354776.pdf
741,38,2,,Association of myocarditis with BNT162b2 messenger RNA COVID-19 vaccine in a case series of children,https://jamanetwork.com/journals/jamacardiology/article-abstract/2783052,JVHp7yDtRrwJ,"A Dionne, F Sperotto, S Chamberlain, AL Baker… - JAMA …, 2021 - jamanetwork.com","… It was not reported in the initial messenger RNA COVID-19 vaccine trials, … after COVID-19 vaccine has been reported. In this series, we detail the occurrence of myocarditis after COVID-…",57,"https://scholar.google.com/scholar?cites=13566791653219979557&as_sdt=20005&sciodt=0,9&hl=en&num=20",13566791653219979557,10,"https://scholar.google.com/scholar?cluster=13566791653219979557&hl=en&num=20&as_sdt=0,9&as_ylo=2019",13566791653219979557,HTML,jamanetwork.com,https://jamanetwork.com/journals/jamacardiology/fullarticle/2783052
742,38,3,,Using best practices to address COVID-19 vaccine hesitancy: the case for the motivational interviewing approach,https://journals.sagepub.com/doi/abs/10.1177/15248399211016463,I2GpJL0gAkcJ,"A Gabarda, SW Butterworth - Health promotion practice, 2021 - journals.sagepub.com","… -19) pandemic is dependent on the uptake of the COVID-19 vaccine. Many factors have … As such, vaccine hesitancy may be more prevalent for the COVID-19 vaccine than others. …",10,"https://scholar.google.com/scholar?cites=5116688123382292771&as_sdt=20005&sciodt=0,9&hl=en&num=20",5116688123382292771,8,"https://scholar.google.com/scholar?cluster=5116688123382292771&hl=en&num=20&as_sdt=0,9&as_ylo=2019",5116688123382292771,,,
743,38,4,Html,Will vaccine-derived protective immunity curtail COVID-19 variants in the US?,https://www.sciencedirect.com/science/article/pii/S2468042721000609,Adwvu4inTmcJ,"M Mancuso, SE Eikenberry, AB Gumel - Infectious Disease Modelling, 2021 - Elsevier","… the impact of the vaccine-induced cross-protective efficacy on the spread the COVID-19 … SARS-CoV-2 variant, the vaccine-derived herd immunity threshold needed to eliminate the …",12,"https://scholar.google.com/scholar?cites=7444071439787875329&as_sdt=20005&sciodt=0,9&hl=en&num=20",7444071439787875329,10,"https://scholar.google.com/scholar?cluster=7444071439787875329&hl=en&num=20&as_sdt=0,9&as_ylo=2019",7444071439787875329,HTML,sciencedirect.com,https://www.sciencedirect.com/science/article/pii/S2468042721000609
744,38,5,,Negative vaccine attitudes and intentions to vaccinate against Covid-19 in relation to smoking status: A population survey of UK adults,https://academic.oup.com/ntr/article-abstract/23/9/1623/6159686,AS3ii0tTeOEJ,"SE Jackson, E Paul, J Brown, A Steptoe… - Nicotine and Tobacco …, 2021 - academic.oup.com",… to take up the offer of a Covid-19 vaccine when offered. Targeted policy action may be required to ensure that low uptake of Covid-19 vaccination programs does not compound health …,17,"https://scholar.google.com/scholar?cites=16246827239673572609&as_sdt=20005&sciodt=0,9&hl=en&num=20",16246827239673572609,16,"https://scholar.google.com/scholar?cluster=16246827239673572609&hl=en&num=20&as_sdt=0,9&as_ylo=2019",16246827239673572609,HTML,oup.com,https://academic.oup.com/ntr/article/23/9/1623/6159686
745,38,6,,COVID‐19 treatment by repurposing drugs until the vaccine is in sight,https://onlinelibrary.wiley.com/doi/abs/10.1002/ddr.21666,7AN9I7jMwcAJ,"M Phadke, S Saunik - Drug development research, 2020 - Wiley Online Library","… time that an effective vaccine is available for COVID-19 viral … antihypertensive drug, to control COVID-19 virus from gaining … properties to prevent acute lung injury in COVID-19 infection. …",82,"https://scholar.google.com/scholar?cites=13889607817028764652&as_sdt=20005&sciodt=0,9&hl=en&num=20",13889607817028764652,11,"https://scholar.google.com/scholar?cluster=13889607817028764652&hl=en&num=20&as_sdt=0,9&as_ylo=2019",13889607817028764652,HTML,nih.gov,https://www.ncbi.nlm.nih.gov/pmc/articles/pmc7228332/
746,38,7,,What defines an efficacious COVID-19 vaccine? A review of the challenges assessing the clinical efficacy of vaccines against SARS-CoV-2,https://www.sciencedirect.com/science/article/pii/S1473309920307738,ABWsywBEhRUJ,"SH Hodgson, K Mansatta, G Mallett, V Harris… - The lancet infectious …, 2021 - Elsevier",… Although some countries might deploy COVID-19 … of vaccine development is to gain direct evidence of vaccine efficacy in protecting humans against SARS-CoV-2 infection and COVID-…,399,"https://scholar.google.com/scholar?cites=1550720416906745088&as_sdt=20005&sciodt=0,9&hl=en&num=20",1550720416906745088,15,"https://scholar.google.com/scholar?cluster=1550720416906745088&hl=en&num=20&as_sdt=0,9&as_ylo=2019",1550720416906745088,HTML,nih.gov,https://www.ncbi.nlm.nih.gov/pmc/articles/pmc7837315/
747,38,8,Html,Developing a low-cost and accessible COVID-19 vaccine for global health,https://journals.plos.org/plosntds/article?id=10.1371/journal.pntd.0008548,Fs5sd6ZhB84J,"PJ Hotez, ME Bottazzi - PLoS neglected tropical diseases, 2020 - journals.plos.org","… /or COVID-… vaccine to protect against both SARS and COVID-19 [9], and in parallel accelerate the advancement of the SARS-CoV-2 RBD candidate as a homologous COVID-19 vaccine …",43,"https://scholar.google.com/scholar?cites=14845942064246214166&as_sdt=20005&sciodt=0,9&hl=en&num=20",14845942064246214166,11,"https://scholar.google.com/scholar?cluster=14845942064246214166&hl=en&num=20&as_sdt=0,9&as_ylo=2019",14845942064246214166,HTML,plos.org,https://journals.plos.org/plosntds/article?id=10.1371/journal.pntd.0008548
