,page_number,position,result_type,title,link,result_id,publication_info_summary,snippet,cited_by_count,cited_by_link,cited_by_id,total_versions,all_versions_link,all_versions_id,file_format,file_title,file_link
262,14,3,Html,Preliminary findings of mRNA Covid-19 vaccine safety in pregnant persons,https://www.nejm.org/doi/full/10.1056/NEJMoa2104983,3_I-zba6F8sJ,"TT Shimabukuro, SY Kim, TR Myers… - … England Journal of …, 2021 - Mass Medical Soc","… a Covid-19 vaccine. During the first week after vaccination with any dose of a Covid-19 vaccine, … To identify persons who received one or both Covid-19 vaccine doses while pregnant or …",502,"https://scholar.google.com/scholar?cites=14634370808453984991&as_sdt=20005&sciodt=0,9&hl=en&num=20",14634370808453984991,19,"https://scholar.google.com/scholar?cluster=14634370808453984991&hl=en&num=20&as_sdt=0,9&as_ylo=2019",14634370808453984991,HTML,nejm.org,https://www.nejm.org/doi/full/10.1056/NEJMoa2104983
263,14,4,Html,Safety and immunogenicity of two RNA-based Covid-19 vaccine candidates,https://www.nejm.org/doi/full/10.1056/NEJMoa2027906,2822apAC2sIJ,"EE Walsh, RW Frenck Jr, AR Falsey… - … England Journal of …, 2020 - Mass Medical Soc","… (Covid-19), have spread to millions of persons worldwide. Multiple vaccine candidates are under development, but no vaccine … Interim safety and immunogenicity data about the vaccine …",1610,"https://scholar.google.com/scholar?cites=14040537607569853915&as_sdt=20005&sciodt=0,9&hl=en&num=20",14040537607569853915,18,"https://scholar.google.com/scholar?cluster=14040537607569853915&hl=en&num=20&as_sdt=0,9&as_ylo=2019",14040537607569853915,HTML,nejm.org,https://www.nejm.org/doi/full/10.1056/NEJMoa2027906
264,14,5,Html,Trajectories of COVID-19 vaccine intentions among US adults: The role of race and ethnicity,https://www.sciencedirect.com/science/article/pii/S2352827321000999,TRS2ytMpFmMJ,"MD Niño, BN Hearne, T Cai - SSM-population health, 2021 - Elsevier","… COVID-19 vaccine intentions from April 2020 to January 2021, and (b.) examine whether race and ethnicity shape COVID-19 vaccine … used to assess overall COVID-19 vaccine intention …",14,"https://scholar.google.com/scholar?cites=7139940248858268749&as_sdt=20005&sciodt=0,9&hl=en&num=20",7139940248858268749,10,"https://scholar.google.com/scholar?cluster=7139940248858268749&hl=en&num=20&as_sdt=0,9&as_ylo=2019",7139940248858268749,HTML,sciencedirect.com,https://www.sciencedirect.com/science/article/pii/S2352827321000999
265,14,6,Html,“When Will We Have a Vaccine?” — Understanding Questions and Answers about Covid-19 Vaccination,https://www.nejm.org/doi/full/10.1056/NEJMp2025331,a8qJPTi8mp8J,"BR Bloom, GJ Nowak, W Orenstein - New England Journal of …, 2020 - Mass Medical Soc","… A more complete answer to the common question is therefore, “We will have a safe and effective Covid-19 vaccine when the research studies, engagement processes, communication, …",58,"https://scholar.google.com/scholar?cites=11500711548180613739&as_sdt=20005&sciodt=0,9&hl=en&num=20",11500711548180613739,10,"https://scholar.google.com/scholar?cluster=11500711548180613739&hl=en&num=20&as_sdt=0,9&as_ylo=2019",11500711548180613739,HTML,nejm.org,https://www.nejm.org/doi/full/10.1056/NEJMp2025331
266,14,7,,COVID-19 Vaccine Booster: To Boost or Not to Boost,https://www.mdpi.com/1333498,29dYbTYAve0J,"R Shekhar, I Garg, S Pal, S Kottewar… - Infectious Disease …, 2021 - mdpi.com","… Pfizer-BioNTech COVID-19 vaccine and the Moderna COVID-19 vaccine to allow them … vaccine and after four weeks for the Moderna vaccine. As of 7 October 2021, COVID-19 vaccine …",11,"https://scholar.google.com/scholar?cites=17130848791350007771&as_sdt=20005&sciodt=0,9&hl=en&num=20",17130848791350007771,12,"https://scholar.google.com/scholar?cluster=17130848791350007771&hl=en&num=20&as_sdt=0,9&as_ylo=2019",17130848791350007771,HTML,mdpi.com,https://www.mdpi.com/2036-7449/13/4/84/htm
267,14,8,,Acceptability of a COVID-19 vaccine among adults in the United States: How many people would get vaccinated?,https://www.sciencedirect.com/science/article/pii/S0264410X20310847,ngVLnXSthb4J,"PL Reiter, ML Pennell, ML Katz - Vaccine, 2020 - Elsevier","… to get a COVID-19 vaccine, though acceptability should be monitored as vaccine development … to increase COVID-19 vaccine acceptability (and uptake if a vaccine becomes available). …",593,"https://scholar.google.com/scholar?cites=13728569755475576222&as_sdt=20005&sciodt=0,9&hl=en&num=20",13728569755475576222,10,"https://scholar.google.com/scholar?cluster=13728569755475576222&hl=en&num=20&as_sdt=0,9&as_ylo=2019",13728569755475576222,HTML,nih.gov,https://www.ncbi.nlm.nih.gov/pmc/articles/pmc7440153/
268,14,9,Html,Priority COVID-19 vaccination for patients with cancer while vaccine supply is limited,https://cancerdiscovery.aacrjournals.org/content/11/2/233.,9XDNrREA4V8J,"A Ribas, R Sengupta, T Locke, SK Zaidi, KM Campbell… - Cancer discovery, 2021 - AACR",… to a limited COVID-19 vaccine supply and concluded that patients with cancer are at a higher risk for severe COVID-19 and should be one of the groups considered for early COVID-19 …,120,"https://scholar.google.com/scholar?cites=6908803379293417717&as_sdt=20005&sciodt=0,9&hl=en&num=20",6908803379293417717,13,"https://scholar.google.com/scholar?cluster=6908803379293417717&hl=en&num=20&as_sdt=0,9&as_ylo=2019",6908803379293417717,HTML,aacrjournals.org,https://cancerdiscovery.aacrjournals.org/content/11/2/233.
269,14,10,Html,"Allergic reactions including anaphylaxis after receipt of the first dose of Pfizer-BioNTech COVID-19 vaccine—United States, December 14–23, 2020",https://www.ncbi.nlm.nih.gov/pmc/articles/pmc7808711/,fTXDmG9t0AEJ,"CDC COVID, R Team - Morbidity and Mortality Weekly Report, 2021 - ncbi.nlm.nih.gov","… (ie, on December 18, 2020), and the Moderna vaccine was only available … COVID-19 vaccine. An assessment of adverse events reported after receipt of the Moderna COVID-19 vaccine …",154,"https://scholar.google.com/scholar?cites=130724715265471869&as_sdt=20005&sciodt=0,9&hl=en&num=20",130724715265471869,22,"https://scholar.google.com/scholar?cluster=130724715265471869&hl=en&num=20&as_sdt=0,9&as_ylo=2019",130724715265471869,HTML,nih.gov,https://www.ncbi.nlm.nih.gov/pmc/articles/pmc7808711/
270,14,11,,"Global COVID-19 vaccine inequity: The scope, the impact, and the challenges",https://www.sciencedirect.com/science/article/pii/S1931312821002857,zDDHlUGimCsJ,"A Asundi, C O'Leary, N Bhadelia - Cell Host & Microbe, 2021 - Elsevier","… Global vaccine inequity is prolonging the COVID-19 pandemic. Here, we outline the scope and impact of inequitable vaccine distribution and identify challenges in vaccine development…",28,"https://scholar.google.com/scholar?cites=3141439142660354252&as_sdt=20005&sciodt=0,9&hl=en&num=20",3141439142660354252,8,"https://scholar.google.com/scholar?cluster=3141439142660354252&hl=en&num=20&as_sdt=0,9&as_ylo=2019",3141439142660354252,HTML,nih.gov,https://www.ncbi.nlm.nih.gov/pmc/articles/PMC8279498/
271,14,12,,Preferences for a COVID-19 vaccine in Australia,https://www.sciencedirect.com/science/article/pii/S0264410X20315991,CaCyfqCdpA4J,"A Borriello, D Master, A Pellegrini, JM Rose - Vaccine, 2021 - Elsevier","… COVID-19 vaccine is the most sustainable option to manage the current pandemic. However, vaccine … The objective of this research is to investigate the vaccine characteristics that …",78,"https://scholar.google.com/scholar?cites=1055141525357502473&as_sdt=20005&sciodt=0,9&hl=en&num=20",1055141525357502473,10,"https://scholar.google.com/scholar?cluster=1055141525357502473&hl=en&num=20&as_sdt=0,9&as_ylo=2019",1055141525357502473,HTML,nih.gov,https://www.ncbi.nlm.nih.gov/pmc/articles/pmc7832016/
272,14,13,,“COVID arm”: A reaction to the Moderna vaccine,https://www.jaadcasereports.org/article/S2352-5126(21)00129-6/abstract,1UQTge_5DVcJ,"N Wei, M Fishman, D Wattenberg, M Gordon… - JAAD case …, 2021 - jaadcasereports.org","… “COVID arm” is an uncommon adverse effect that can present as a localized, transient erythematous rash several days following the first dose of the Moderna COVID-19 vaccine. … COVID …",40,"https://scholar.google.com/scholar?cites=6272944663054992597&as_sdt=20005&sciodt=0,9&hl=en&num=20",6272944663054992597,8,"https://scholar.google.com/scholar?cluster=6272944663054992597&hl=en&num=20&as_sdt=0,9&as_ylo=2019",6272944663054992597,HTML,jaadcasereports.org,https://www.jaadcasereports.org/article/S2352-5126(21)00129-6/fulltext
273,14,14,,Are COVID-19 vaccine boosters needed? the science behind boosters,https://journals.asm.org/doi/abs/10.1128/JVI.01973-21,HMMobrU5O5YJ,"RM Burckhardt, JJ Dennehy, LLM Poon, LJ Saif… - Journal of …, 2021 - Am Soc Microbiol",… durability of vaccine-induced B or T cell responses in COVID-… of US patients hospitalized with COVID-19-like illness and … -confirmed COVID-19 than mRNA vaccine recipients with no …,4,"https://scholar.google.com/scholar?cites=10825309580715148060&as_sdt=20005&sciodt=0,9&hl=en&num=20",10825309580715148060,6,"https://scholar.google.com/scholar?cluster=10825309580715148060&hl=en&num=20&as_sdt=0,9&as_ylo=2019",10825309580715148060,PDF,asm.org,https://journals.asm.org/doi/pdf/10.1128/jvi.01973-21
274,14,15,,Analyzing the attitude of Indian citizens towards COVID-19 vaccine–A text analytics study,https://www.sciencedirect.com/science/article/pii/S1871402121000618,20PjF5clFWYJ,"SV Praveen, R Ittamalla, G Deepak - Diabetes & Metabolic Syndrome …, 2021 - Elsevier","… ’ mental attitudes towards the COVID-19 vaccine and the effect of the … ‘Covid vaccine.’ For this study, we have chosen Twitter as a data source because, after the outbreak of COVID-19, …",37,"https://scholar.google.com/scholar?cites=7355826897250632667&as_sdt=20005&sciodt=0,9&hl=en&num=20",7355826897250632667,8,"https://scholar.google.com/scholar?cluster=7355826897250632667&hl=en&num=20&as_sdt=0,9&as_ylo=2019",7355826897250632667,HTML,nih.gov,https://www.ncbi.nlm.nih.gov/pmc/articles/pmc7910132/
275,14,16,,The challenges of distributing COVID-19 vaccinations,https://www.thelancet.com/journals/eclinm/article/PIIS2589-5370(20)30418-1/fulltext,1ScBCyixllcJ,"MC Mills, D Salisbury - EClinicalMedicine, 2021 - thelancet.com","… efficacy results for their COVID-19 vaccine, confirming levels of 95… , we need transparency about vaccine distribution and … need to be in place: vaccine supplies (cold storage, distribution, …",76,"https://scholar.google.com/scholar?cites=6311426713347762133&as_sdt=20005&sciodt=0,9&hl=en&num=20",6311426713347762133,10,"https://scholar.google.com/scholar?cluster=6311426713347762133&hl=en&num=20&as_sdt=0,9&as_ylo=2019",6311426713347762133,PDF,thelancet.com,https://www.thelancet.com/pdfs/journals/eclinm/PIIS2589-5370%2820%2930418-1.pdf
276,14,17,Html,Examining the effect of information channel on COVID-19 vaccine acceptance,https://journals.plos.org/plosone/article?id=10.1371/journal.pone.0251095,AdRPGS3S4voJ,"R Piltch-Loeb, E Savoia, B Goldberg, B Hughes… - PLoS …, 2021 - journals.plos.org",… channels for COVID-19 vaccine information and determine the relationship between information channel and vaccine acceptance. We used quota sampling of vaccine priority groups [N …,54,"https://scholar.google.com/scholar?cites=18078242945358615553&as_sdt=20005&sciodt=0,9&hl=en&num=20",18078242945358615553,15,"https://scholar.google.com/scholar?cluster=18078242945358615553&hl=en&num=20&as_sdt=0,9&as_ylo=2019",18078242945358615553,HTML,plos.org,https://journals.plos.org/plosone/article?id=10.1371/journal.pone.0251095
277,14,18,Html,Acceptance of a COVID-19 vaccine in Southeast Asia: a cross-sectional study in Indonesia,https://www.frontiersin.org/articles/10.3389/fpubh.2020.00381/full,qaClxpcidngJ,"H Harapan, AL Wagner, A Yufika, W Winardi… - Frontiers in public …, 2020 - frontiersin.org",… No study has been conducted on COVID-19 vaccine acceptance in the region. This study sought to assess the acceptance of a hypothetical COVID-19 vaccine among the general …,353,"https://scholar.google.com/scholar?cites=8680163367071359145&as_sdt=20005&sciodt=0,9&hl=en&num=20",8680163367071359145,12,"https://scholar.google.com/scholar?cluster=8680163367071359145&hl=en&num=20&as_sdt=0,9&as_ylo=2019",8680163367071359145,HTML,frontiersin.org,https://www.frontiersin.org/articles/10.3389/fpubh.2020.00381/full
278,14,19,Pdf,You can't sue Pfizer or Moderna if you have severe Covid vaccine side effects. The government likely won't compensate you for damages either,http://www.trueworldpolitics.com/video-pages/images/covid-vaccine-you-cant-sue-pfizer-or-mModerna-over-side-effects-and-the-government-wont-compensate-you-either.pdf,Z2d_IJxcgiEJ,"MK Sigalos - CNBC. December, 2020 - trueworldpolitics.com","… “The government doesn’t want people suing the companies making the Covid vaccine. Because then, the manufacturers would probably charge the government a higher price per …",3,"https://scholar.google.com/scholar?cites=2414594175853881191&as_sdt=20005&sciodt=0,9&hl=en&num=20",2414594175853881191,0,{},{},PDF,trueworldpolitics.com,http://www.trueworldpolitics.com/video-pages/images/covid-vaccine-you-cant-sue-pfizer-or-mModerna-over-side-effects-and-the-government-wont-compensate-you-either.pdf
279,14,20,,Clinical endpoints for evaluating efficacy in COVID-19 vaccine trials,https://www.acpjournals.org/doi/abs/10.7326/m20-6169,hWJWaRRc_e8J,"DV Mehrotra, HE Janes, TR Fleming… - Annals of internal …, 2021 - acpjournals.org","… on study endpoints in COVID-19 vaccine efficacy trials. First, … comparison of the efficacy of vaccine candidates, overall and … COVID-19 as well as assessment of the longer-term vaccine …",72,"https://scholar.google.com/scholar?cites=17293079386908942981&as_sdt=20005&sciodt=0,9&hl=en&num=20",17293079386908942981,15,"https://scholar.google.com/scholar?cluster=17293079386908942981&hl=en&num=20&as_sdt=0,9&as_ylo=2019",17293079386908942981,PDF,acpjournals.org,https://www.acpjournals.org/doi/pdf/10.7326/M20-6169
280,15,1,Html,Correlates of intended COVID-19 vaccine acceptance across time and countries: results from a series of cross-sectional surveys,https://bmjopen.bmj.com/content/11/8/e048025.abstract,DJECTsXOrfQJ,"JR Kerr, CR Schneider, G Recchia, S Dryhurst… - BMJ open, 2021 - bmjopen.bmj.com","… By identifying antecedents of vaccine hesitancy, policy … Recent evidence shows that acceptance of a COVID-19 vaccine … statement: ‘If a COVID-19 vaccine is proven safe and effective …",20,"https://scholar.google.com/scholar?cites=17630975463038030092&as_sdt=20005&sciodt=0,9&hl=en&num=20",17630975463038030092,20,"https://scholar.google.com/scholar?cluster=17630975463038030092&hl=en&num=20&as_sdt=0,9&as_ylo=2019",17630975463038030092,HTML,bmj.com,https://bmjopen.bmj.com/content/11/8/e048025.abstract
281,15,2,,Factors affecting COVID-19 vaccine acceptance: an international survey among low-and middle-income countries,https://www.mdpi.com/1112148,ERVNORTav6oJ,"SA Bono, E Faria de Moura Villela, CS Siau, WS Chen… - Vaccines, 2021 - mdpi.com","… to take the COVID-19 vaccine across selected LMICs, and to investigate the factors that predicted the willingness to be vaccinated at 90% and 95% vaccine effectiveness levels. We …",68,"https://scholar.google.com/scholar?cites=12303792487395038481&as_sdt=20005&sciodt=0,9&hl=en&num=20",12303792487395038481,18,"https://scholar.google.com/scholar?cluster=12303792487395038481&hl=en&num=20&as_sdt=0,9&as_ylo=2019",12303792487395038481,PDF,mdpi.com,https://www.mdpi.com/2076-393X/9/5/515/pdf
282,15,3,,Sharing technology and vaccine doses to address global vaccine inequity and end the COVID-19 pandemic,https://jamanetwork.com/journals/jama/article-abstract/2781756,eObH9QTjQkwJ,"MM Kavanagh, LO Gostin, M Sunder - JAMA, 2021 - jamanetwork.com","… Approximately 1.2% of the global vaccine supply has been received by low-income … , and vaccine supplies would fully vaccinate just 9% of the total population. Vaccine inequity is driven …",15,"https://scholar.google.com/scholar?cites=5495204105788319352&as_sdt=20005&sciodt=0,9&hl=en&num=20",5495204105788319352,7,"https://scholar.google.com/scholar?cluster=5495204105788319352&hl=en&num=20&as_sdt=0,9&as_ylo=2019",5495204105788319352,HTML,jamanetwork.com,https://jamanetwork.com/journals/jama/fullarticle/2781756
283,15,4,,"While studies on COVID‐19 vaccine is ongoing, the public's thoughts and attitudes to the future COVID‐19 vaccine",https://onlinelibrary.wiley.com/doi/abs/10.1111/ijcp.13891,LLz6_1a-wE8J,"B Akarsu, D Canbay Özdemir… - … journal of clinical …, 2021 - Wiley Online Library","… against COVID-19; if the vaccine for COVID-19 is developed. The request for the COVID-19 vaccine … “Afraid of the side effects of vaccine”, “don't think it can be reliable as it will be a new …",87,"https://scholar.google.com/scholar?cites=5746802405395840044&as_sdt=20005&sciodt=0,9&hl=en&num=20",5746802405395840044,14,"https://scholar.google.com/scholar?cluster=5746802405395840044&hl=en&num=20&as_sdt=0,9&as_ylo=2019",5746802405395840044,HTML,nih.gov,https://www.ncbi.nlm.nih.gov/pmc/articles/pmc7883065/
284,15,5,,The BNT162b2 (BioNTech/Pfizer) vaccine had 95% efficacy against COVID-19≥ 7 days after the 2nd dose,https://www.acpjournals.org/doi/full/10.7326/ACPJ202102160-015,YwK89ZshmVcJ,"Z Chagla - Annals of internal medicine, 2021 - acpjournals.org","… The development of a COVID-19 vaccine, based on an experimental mRNA platform, in less than 1 year after sequencing of severe acute respiratory syndrome coronavirus-2 is …",60,"https://scholar.google.com/scholar?cites=6312113306462847587&as_sdt=20005&sciodt=0,9&hl=en&num=20",6312113306462847587,6,"https://scholar.google.com/scholar?cluster=6312113306462847587&hl=en&num=20&as_sdt=0,9&as_ylo=2019",6312113306462847587,,,
285,15,6,,Market design to accelerate COVID-19 vaccine supply,https://www.science.org/doi/abs/10.1126/science.abg0889,WottwpPsb8EJ,"JC Castillo, A Ahuja, S Athey, A Baker, E Budish… - Science, 2021 - science.org","… In our model, a unit of capacity is defined as the fixed investment needed for one course per year of a regulatory-approved COVID-19 vaccine, including production lines as well as …",76,"https://scholar.google.com/scholar?cites=13938619491101281114&as_sdt=20005&sciodt=0,9&hl=en&num=20",13938619491101281114,12,"https://scholar.google.com/scholar?cluster=13938619491101281114&hl=en&num=20&as_sdt=0,9&as_ylo=2019",13938619491101281114,HTML,science.org,https://www.science.org/doi/full/10.1126/science.abg0889
286,15,7,,Willingness to get the COVID-19 vaccine with and without emergency use authorization,https://www.sciencedirect.com/science/article/pii/S0196655320310026,onM7lqB0RLAJ,"JPD Guidry, LI Laestadius, EK Vraga, CA Miller… - American journal of …, 2021 - Elsevier",… predictors of US adults’ willingness to get a future COVID-19 vaccine and whether these predictors differ under an emergency use authorization (EUA) release of the vaccine. …,229,"https://scholar.google.com/scholar?cites=12701405082155709346&as_sdt=20005&sciodt=0,9&hl=en&num=20",12701405082155709346,13,"https://scholar.google.com/scholar?cluster=12701405082155709346&hl=en&num=20&as_sdt=0,9&as_ylo=2019",12701405082155709346,HTML,nih.gov,https://www.ncbi.nlm.nih.gov/pmc/articles/PMC7677682/
287,15,8,Html,Effectiveness of the Pfizer-BioNTech COVID-19 vaccine among residents of two skilled nursing facilities experiencing COVID-19 outbreaks—Connecticut …,https://www.ncbi.nlm.nih.gov/pmc/articles/pmc7976620/,iMHSKhphGC0J,"A Britton, KMJ Slifka, C Edens, SA Nanduri… - … and Mortality Weekly …, 2021 - ncbi.nlm.nih.gov","… were prioritized for early COVID-19 vaccination (1,2). However, this group was not included in COVID-19 vaccine clinical trials, and limited postauthorization vaccine effectiveness (VE) …",110,"https://scholar.google.com/scholar?cites=3249453896163312008&as_sdt=20005&sciodt=0,9&hl=en&num=20",3249453896163312008,14,"https://scholar.google.com/scholar?cluster=3249453896163312008&hl=en&num=20&as_sdt=0,9&as_ylo=2019",3249453896163312008,HTML,nih.gov,https://www.ncbi.nlm.nih.gov/pmc/articles/pmc7976620/
288,15,9,,COVID-19 vaccine hesitancy: the five Cs to tackle behavioural and sociodemographic factors,https://journals.sagepub.com/doi/abs/10.1177/01410768211018951,DfvAbv2JoQAJ,"MS Razai, P Oakeshott, A Esmail… - Journal of the Royal …, 2021 - journals.sagepub.com",… The global roll-out of the COVID-19 vaccine is a cause for … the ongoing damage wrought by COVID-19 is largely contingent … We propose five Cs to tackle vaccine hesitancy: Confidence (…,30,"https://scholar.google.com/scholar?cites=45469192828287757&as_sdt=20005&sciodt=0,9&hl=en&num=20",45469192828287757,9,"https://scholar.google.com/scholar?cluster=45469192828287757&hl=en&num=20&as_sdt=0,9&as_ylo=2019",45469192828287757,HTML,sagepub.com,https://journals.sagepub.com/doi/full/10.1177/01410768211018951
289,15,10,Html,An interactive website tracking COVID-19 vaccine development,https://www.thelancet.com/journals/langlo/article/PIIS2214-109X(21)00043-7/fulltext,HBUdhm2-xbsJ,"M Shrotri, T Swinnen, B Kampmann… - The Lancet Global …, 2021 - thelancet.com","… The rapid progress in COVID-19 vaccine development is a … transparent information regarding COVID-19 vaccine safety, efficacy… of the ongoing vaccine roll-out extend beyond COVID-19 …",73,"https://scholar.google.com/scholar?cites=13530430033115288860&as_sdt=20005&sciodt=0,9&hl=en&num=20",13530430033115288860,8,"https://scholar.google.com/scholar?cluster=13530430033115288860&hl=en&num=20&as_sdt=0,9&as_ylo=2019",13530430033115288860,HTML,thelancet.com,https://www.thelancet.com/journals/langlo/article/PIIS2214-109X(21)00043-7/fulltext
290,15,11,,Myths and conspiracy theories on vaccines and COVID-19: Potential effect on global vaccine refusals,https://www.sciencedirect.com/science/article/pii/S1576988721000108,1MlMPnospNsJ,"I Ullah, KS Khan, MJ Tahir, A Ahmed, H Harapan - Vacunas, 2021 - Elsevier",… movements and COVID-19-related myths and conspiracy theories. This review discusses … to COVID-19 and vaccine on COVID-19 vaccine refusals as well as other vaccine programs. …,75,"https://scholar.google.com/scholar?cites=15826823894029617620&as_sdt=20005&sciodt=0,9&hl=en&num=20",15826823894029617620,13,"https://scholar.google.com/scholar?cluster=15826823894029617620&hl=en&num=20&as_sdt=0,9&as_ylo=2019",15826823894029617620,HTML,nih.gov,https://www.ncbi.nlm.nih.gov/pmc/articles/pmc8220986/
291,15,12,Html,"Allergic reactions including anaphylaxis after receipt of the first dose of Moderna COVID-19 vaccine—United States, December 21, 2020–January 10, 2021",https://www.ncbi.nlm.nih.gov/pmc/articles/PMC7842812/,7om_BObOAjoJ,"CDC COVID, R Team - Morbidity and Mortality Weekly Report, 2021 - ncbi.nlm.nih.gov",… Early safety monitoring of Moderna COVID-19 vaccine detected 10 cases of anaphylaxis … doses of Moderna COVID-19 vaccine (2.5 cases per million Moderna COVID-19 vaccine doses …,75,"https://scholar.google.com/scholar?cites=4180130891470703086&as_sdt=20005&sciodt=0,9&hl=en&num=20",4180130891470703086,11,"https://scholar.google.com/scholar?cluster=4180130891470703086&hl=en&num=20&as_sdt=0,9&as_ylo=2019",4180130891470703086,HTML,nih.gov,https://www.ncbi.nlm.nih.gov/pmc/articles/PMC7842812/
292,15,13,,The VACCINES Act: deciphering vaccine hesitancy in the time of COVID-19,https://academic.oup.com/cid/article-abstract/71/15/703/5819529,mT2FCx2yaQsJ,"J McAteer, I Yildirim, A Chahroudi - Clinical Infectious Diseases, 2020 - academic.oup.com","… if the COVID-19 pandemic will begin to change minds regarding the overwhelming value of immunization, we fear that as time elapses and memories fade, a SARS-CoV-2 vaccine may …",85,"https://scholar.google.com/scholar?cites=822384244788903321&as_sdt=20005&sciodt=0,9&hl=en&num=20",822384244788903321,9,"https://scholar.google.com/scholar?cluster=822384244788903321&hl=en&num=20&as_sdt=0,9&as_ylo=2019",822384244788903321,HTML,oup.com,https://academic.oup.com/cid/article/71/15/703/5819529?login=true
293,15,14,Html,A tale of two crises: addressing Covid-19 vaccine hesitancy as promoting racial justice,https://link.springer.com/article/10.1007/s10730-021-09440-0,MnojvIK7KgUJ,"L Bunch - Hec Forum, 2021 - Springer","… toward a Covid-19 vaccine. But the influenza vaccine and the Covid-19 vaccine candidates … Most plainly, influenza and Covid-19 have similar disease presentation (respiratory disease)…",45,"https://scholar.google.com/scholar?cites=372316089388071474&as_sdt=20005&sciodt=0,9&hl=en&num=20",372316089388071474,11,"https://scholar.google.com/scholar?cluster=372316089388071474&hl=en&num=20&as_sdt=0,9&as_ylo=2019",372316089388071474,HTML,springer.com,https://link.springer.com/article/10.1007/s10730-021-09440-0
294,15,15,,Assessing the level and determinants of COVID-19 vaccine confidence in Kenya,https://www.mdpi.com/2076-393X/9/8/936,yczMfv68TLsJ,"S Orangi, J Pinchoff, D Mwanga, T Abuya, M Hamaluba… - Vaccines, 2021 - mdpi.com","… Kenya reports a high vaccine confidence … COVID-19 vaccine in Kenya, which mainly targets the adult population. This study, therefore, aims to determine the level of COVID-19 vaccine …",13,"https://scholar.google.com/scholar?cites=13496369984557599945&as_sdt=20005&sciodt=0,9&hl=en&num=20",13496369984557599945,16,"https://scholar.google.com/scholar?cluster=13496369984557599945&hl=en&num=20&as_sdt=0,9&as_ylo=2019",13496369984557599945,PDF,mdpi.com,https://www.mdpi.com/2076-393X/9/8/936/pdf
