,page_number,position,result_type,title,link,result_id,publication_info_summary,snippet,cited_by_count,cited_by_link,cited_by_id,total_versions,all_versions_link,all_versions_id,file_format,file_title,file_link
0,1,1,Pdf,The UK has approved a COVID vaccine—here's what scientists now want to know,https://www.icpcovid.com/sites/default/files/2020-12/Ep%2092%202B%20The%20UK%20has%20approved%20a%20COVID%20vaccine%20%E2%80%94%20here%E2%80%99s%20what%20scientists%20now%20want%20to%20know.pdf,3cusPb2sw7EJ,"H Ledford, D Cyranoski, R Van Noorden - Nature, 2020 - icpcovid.com","… country to approve a COVID-19 vaccine that has been tested in a large clinical trial. On 2 December, UK regulators granted emergency-use authorization to a vaccine from drug firms …",90,"https://scholar.google.com/scholar?cites=12809271693955353565&as_sdt=20005&sciodt=0,9&hl=en&num=20",12809271693955353565,11,"https://scholar.google.com/scholar?cluster=12809271693955353565&hl=en&num=20&as_sdt=0,9&as_ylo=2019",12809271693955353565,PDF,icpcovid.com,https://www.icpcovid.com/sites/default/files/2020-12/Ep%2092%202B%20The%20UK%20has%20approved%20a%20COVID%20vaccine%20%E2%80%94%20here%E2%80%99s%20what%20scientists%20now%20want%20to%20know.pdf
1,1,2,Html,Escaping catch-22—overcoming covid vaccine hesitancy,https://www.nejm.org/doi/full/10.1056/NEJMms2101220,6oC9c1gXy8sJ,"L Rosenbaum - New England Journal of Medicine, 2021 - Mass Medical Soc","… before Covid, aims to address the challenge of vaccine … any Covid vaccine, Johnson, who has been monitoring vaccine … ’t eventually use it to track Covid vaccine behavior, just like we …",75,"https://scholar.google.com/scholar?cites=14684856678637994218&as_sdt=20005&sciodt=0,9&hl=en&num=20",14684856678637994218,8,"https://scholar.google.com/scholar?cluster=14684856678637994218&hl=en&num=20&as_sdt=0,9&as_ylo=2019",14684856678637994218,HTML,nejm.org,https://www.nejm.org/doi/full/10.1056/NEJMms2101220
2,1,3,Pdf,China COVID vaccine reports mixed results—what does that mean for the pandemic,https://www.icpcovid.com/sites/default/files/2021-01/Ep%20102-10%20China%20COVID%20vaccine%20reports%20mixed%20results%20%E2%80%94%20what%20does%20that%20mean%20for%20the%20pandemic_.pdf,Kd33UhnUq1kJ,"S Mallapaty - Nature, 2021 - icpcovid.com",… COVID-19 vaccine were tinged with disappointment and confusion this week. But researchers say the vaccine … % effective at preventing severe and mild COVID-19 in late-stage trials. …,44,"https://scholar.google.com/scholar?cites=6461491295624355113&as_sdt=20005&sciodt=0,9&hl=en&num=20",6461491295624355113,4,"https://scholar.google.com/scholar?cluster=6461491295624355113&hl=en&num=20&as_sdt=0,9&as_ylo=2019",6461491295624355113,PDF,icpcovid.com,https://www.icpcovid.com/sites/default/files/2021-01/Ep%20102-10%20China%20COVID%20vaccine%20reports%20mixed%20results%20%E2%80%94%20what%20does%20that%20mean%20for%20the%20pandemic_.pdf
3,1,4,,COVID vaccine excitement builds as Moderna reports third positive result,https://go.gale.com/ps/i.do?id=GALE%7CA650807839&sid=googleScholar&v=2.1&it=r&linkaccess=abs&issn=00280836&p=AONE&sw=w,UWUKj-Hpx0YJ,"E Callaway - Nature, 2020 - go.gale.com","… Scientists say that the press-released results share a few more details than last week's positive announcements from Pfizer and BioNTech, which are together working on a rival …",49,"https://scholar.google.com/scholar?cites=5100302257997112657&as_sdt=20005&sciodt=0,9&hl=en&num=20",5100302257997112657,7,"https://scholar.google.com/scholar?cluster=5100302257997112657&hl=en&num=20&as_sdt=0,9&as_ylo=2019",5100302257997112657,,,
4,1,5,Pdf,What scientists do and don't know about the Oxford-AstraZeneca COVID vaccine,https://www.icpcovid.com/sites/default/files/2021-03/Ep%20123-2%20What%20scientists%20do%20and%20don%E2%80%99t%20know%20about%20the%20Oxford%E2%80%93AstraZeneca%20COVID%20vaccine.pdf,wgOZEf6R0o8J,"S Mallapaty, E Callaway - Nature, 2021 - icpcovid.com","… The road keeps getting bumpier for a vaccine that most researchers say … COVID-19 vaccine, officials at a US government agency overseeing the trial questioned claims about the vaccine…",33,"https://scholar.google.com/scholar?cites=10363506212935893954&as_sdt=20005&sciodt=0,9&hl=en&num=20",10363506212935893954,7,"https://scholar.google.com/scholar?cluster=10363506212935893954&hl=en&num=20&as_sdt=0,9&as_ylo=2019",10363506212935893954,PDF,icpcovid.com,https://www.icpcovid.com/sites/default/files/2021-03/Ep%20123-2%20What%20scientists%20do%20and%20don%E2%80%99t%20know%20about%20the%20Oxford%E2%80%93AstraZeneca%20COVID%20vaccine.pdf
5,1,6,Pdf,Oxford covid vaccine results puzzle scientists,https://covidcalltohumanity.org/wp-content/uploads/2020/04/Nature_Why-Oxfords-Positive-COVID-vaccine-results-are-puzzling-scientists.pdf,4l6imMwuapEJ,"E Callaway - Nature, 2020 - covidcalltohumanity.org",… COVID vaccine trials. But the Oxford–AstraZeneca analysis found a striking difference in efficacy depending on the amount of vaccine … a lower amount of the vaccine in the first dose …,34,"https://scholar.google.com/scholar?cites=10478238939299864290&as_sdt=20005&sciodt=0,9&hl=en&num=20",10478238939299864290,10,"https://scholar.google.com/scholar?cluster=10478238939299864290&hl=en&num=20&as_sdt=0,9&as_ylo=2019",10478238939299864290,PDF,covidcalltohumanity.org,https://covidcalltohumanity.org/wp-content/uploads/2020/04/Nature_Why-Oxfords-Positive-COVID-vaccine-results-are-puzzling-scientists.pdf
6,1,7,Pdf,CureVac COVID vaccine let-down spotlights mRNA design challenges,https://www.icpcovid.com/sites/default/files/2021-06/Ep%20147-2%20CureVac%20COVID%20vaccine%20let-down%20spotlights%20mRNA%20design%20challenges.pdf,11NKqnqb9lUJ,"E Dolgin - Nature, 2021 - icpcovid.com","https://www. nature. com/articles/d41586-021-01661-0 2/6 in a final-stage trial, according to an initial report released this week. Researchers are now asking why—and some think that …",23,"https://scholar.google.com/scholar?cites=6194309288640009175&as_sdt=20005&sciodt=0,9&hl=en&num=20",6194309288640009175,8,"https://scholar.google.com/scholar?cluster=6194309288640009175&hl=en&num=20&as_sdt=0,9&as_ylo=2019",6194309288640009175,PDF,icpcovid.com,https://www.icpcovid.com/sites/default/files/2021-06/Ep%20147-2%20CureVac%20COVID%20vaccine%20let-down%20spotlights%20mRNA%20design%20challenges.pdf
7,1,8,,How obesity could create problems for a COVID vaccine.,https://go.gale.com/ps/i.do?id=GALE%7CA639031256&sid=googleScholar&v=2.1&it=r&linkaccess=abs&issn=00280836&p=AONE&sw=w,GzqTcTF9LEAJ,"H Ledford - Nature, 2020 - go.gale.com","… But for Mexico and many other countries with a burgeoning population of people with high body mass indices (BMIs), some researchers fear that a vaccine might not be the …",33,"https://scholar.google.com/scholar?cites=4624208568715000347&as_sdt=20005&sciodt=0,9&hl=en&num=20",4624208568715000347,8,"https://scholar.google.com/scholar?cluster=4624208568715000347&hl=en&num=20&as_sdt=0,9&as_ylo=2019",4624208568715000347,,,
8,1,9,Pdf,Doctorʼs Death After Covid Vaccine Is Being Investigated,https://covidcalltohumanity.org/wp-content/uploads/2021/01/Grady-Mazzel_Doctors-Death-After-Getting-the-Covid19-Vaccine-Is-Investigated.pdf,-m8kg_EwpK4J,"D Grady, P Mazzei - Health, 2021 - covidcalltohumanity.org","… vaccine. It is not yet known if the shot is linked to the illness. … to make people aware of the vaccine’s possible “side effects,” … , “I think it is a medical certainty that the vaccine was related.” …",28,"https://scholar.google.com/scholar?cites=12584237072625463290&as_sdt=20005&sciodt=0,9&hl=en&num=20",12584237072625463290,0,{},{},PDF,covidcalltohumanity.org,https://covidcalltohumanity.org/wp-content/uploads/2021/01/Grady-Mazzel_Doctors-Death-After-Getting-the-Covid19-Vaccine-Is-Investigated.pdf
9,1,10,,COVID vaccine boosters: the most important questions,https://ideas.repec.org/a/nat/nature/v596y2021i7871d10.1038_d41586-021-02158-6.html,r_CqyhukfaIJ,"E Callaway - Nature, 2021 - ideas.repec.org",COVID vaccine boosters: the most important questions … COVID vaccine boosters: the most important questions … Concerns over waning immunity and SARS-CoV-2 variants …,68,"https://scholar.google.com/scholar?cites=11708695045504430255&as_sdt=20005&sciodt=0,9&hl=en&num=20",11708695045504430255,7,"https://scholar.google.com/scholar?cluster=11708695045504430255&hl=en&num=20&as_sdt=0,9&as_ylo=2019",11708695045504430255,,,
10,1,11,,Vaccine-induced immune thrombotic thrombocytopenia and cerebral venous sinus thrombosis post COVID-19 vaccination; a systematic review,https://www.sciencedirect.com/science/article/pii/S0022510X21003014,s0eLPr29D_cJ,"M Sharifian-Dorche, M Bahmanyar… - Journal of the …, 2021 - Elsevier","… vaccine, Johnson & Johnson COVID vaccine, Ad26.COV2 COVID vaccine. The authors evaluated … COV2 COVID vaccine. The authors evaluated the abstracts and titles of each article for …",59,"https://scholar.google.com/scholar?cites=17802656472514643891&as_sdt=20005&sciodt=0,9&hl=en&num=20",17802656472514643891,10,"https://scholar.google.com/scholar?cluster=17802656472514643891&hl=en&num=20&as_sdt=0,9&as_ylo=2019",17802656472514643891,HTML,nih.gov,https://www.ncbi.nlm.nih.gov/pmc/articles/pmc8330139/
11,1,12,Pdf,A few COVID vaccine recipients developed a rare blood disorder,https://covidcalltohumanity.org/wp-content/uploads/2021/02/Grady_A-Few-Covid-Vaccine-Recipients-Developed-a-Rare-Blood-Disorder.pdf,55ookMZuDawJ,"D Grady - New York Times Feb, 2021 - covidcalltohumanity.org","“I think it is possible that there is an association,” Dr. James Bussel, a hematologist and professor emeritus at Weill Cornell Medicine who has written more than 300 scientific articles on …",31,"https://scholar.google.com/scholar?cites=12397687148322003687&as_sdt=20005&sciodt=0,9&hl=en&num=20",12397687148322003687,2,"https://scholar.google.com/scholar?cluster=12397687148322003687&hl=en&num=20&as_sdt=0,9&as_ylo=2019",12397687148322003687,PDF,covidcalltohumanity.org,https://covidcalltohumanity.org/wp-content/uploads/2021/02/Grady_A-Few-Covid-Vaccine-Recipients-Developed-a-Rare-Blood-Disorder.pdf
12,1,13,Pdf,India's COVID-vaccine woes—by the numbers,https://www.icpcovid.com/sites/default/files/2021-04/Ep%20131-9%20India%E2%80%99s%20COVID-vaccine%20woes%20%E2%80%94%20by%20the%20numbers.pdf,iv4MPGUYzxoJ,"TV Padma - Nature, 2021 - icpcovid.com","India, one of the world’s biggest suppliers of vaccines, is facing a COVID-19 vaccine crunch, partly due to an explosion of cases linked to new variants. This spells trouble for many …",26,"https://scholar.google.com/scholar?cites=1931789588243480202&as_sdt=20005&sciodt=0,9&hl=en&num=20",1931789588243480202,8,"https://scholar.google.com/scholar?cluster=1931789588243480202&hl=en&num=20&as_sdt=0,9&as_ylo=2019",1931789588243480202,PDF,icpcovid.com,https://www.icpcovid.com/sites/default/files/2021-04/Ep%20131-9%20India%E2%80%99s%20COVID-vaccine%20woes%20%E2%80%94%20by%20the%20numbers.pdf
13,1,14,Pdf,Oxford Covid-vaccine paper highlights lingering unknowns,https://beautyinthemargins.com/wp-content/uploads/2020/12/Ledford-2020-Oxford-covid-vaccine-paper-highligh.pdf,XhAgEt0Lp9gJ,"H Ledford - Nature, 2020 - beautyinthemargins.com","… “As soon as you get mistrust around a vaccine, you won’t get the vaccine uptake that you … vaccine. An analysis of the first 170 cases of COVID-19 in the group indicated that the vaccine …",17,"https://scholar.google.com/scholar?cites=15611459677422882910&as_sdt=20005&sciodt=0,9&hl=en&num=20",15611459677422882910,10,"https://scholar.google.com/scholar?cluster=15611459677422882910&hl=en&num=20&as_sdt=0,9&as_ylo=2019",15611459677422882910,PDF,beautyinthemargins.com,https://beautyinthemargins.com/wp-content/uploads/2020/12/Ledford-2020-Oxford-covid-vaccine-paper-highligh.pdf
14,1,15,,Mounting evidence suggests Sputnik COVID vaccine is safe and effective,https://ideas.repec.org/a/nat/nature/v595y2021i7867d10.1038_d41586-021-01813-2.html,tls_Fts296oJ,"B Nogrady - Nature, 2021 - ideas.repec.org",Mounting evidence suggests Sputnik COVID vaccine is safe and effective … Mounting evidence suggests Sputnik COVID vaccine is safe and effective … Russia’s vaccine is in …,44,"https://scholar.google.com/scholar?cites=12319375620294269878&as_sdt=20005&sciodt=0,9&hl=en&num=20",12319375620294269878,6,"https://scholar.google.com/scholar?cluster=12319375620294269878&hl=en&num=20&as_sdt=0,9&as_ylo=2019",12319375620294269878,,,
15,1,16,,Covid vaccine could be rolled out to children by autumn,https://search.proquest.com/openview/98627363dbbff7fdfd35c79ecaff08c3/1?pq-origsite=gscholar&cbl=2043523,KE_3Akqi-IcJ,"E Mahase - BMJ: British Medical Journal (Online), 2021 - search.proquest.com","… The Oxford research group is also testing its vaccine in children aged 6-17, in a trial funded … will receive the covid-19 vaccine, while the rest will be given a control meningitis vaccine—…",21,"https://scholar.google.com/scholar?cites=9797759428105555752&as_sdt=20005&sciodt=0,9&hl=en&num=20",9797759428105555752,7,"https://scholar.google.com/scholar?cluster=9797759428105555752&hl=en&num=20&as_sdt=0,9&as_ylo=2019",9797759428105555752,PDF,archive.org,https://scholar.archive.org/work/zvfw7vexavcltmklw4rjvtotty/access/wayback/https://www.bmj.com/content/bmj/372/bmj.n723.full.pdf
16,1,17,,COVID-vaccine results are on the way-and scientists' concerns are growing.,https://pesquisa.bvsalud.org/global-literature-on-novel-coronavirus-2019-ncov/resource/pt/covidwho-795427,MhGEyRkkZzEJ,"S Mallapaty, H Ledford - Nature, 2020 - pesquisa.bvsalud.org","… COVID-19 … COVID-vaccine results are on the way - and scientists' concerns are growing. … , Vacinas Virais/efeitos adversos , COVID-19 , Vacinas contra COVID-19 , Protocolos de Ensaio …",29,"https://scholar.google.com/scholar?cites=3559853723633324338&as_sdt=20005&sciodt=0,9&hl=en&num=20",3559853723633324338,7,"https://scholar.google.com/scholar?cluster=3559853723633324338&hl=en&num=20&as_sdt=0,9&as_ylo=2019",3559853723633324338,,,
17,1,18,,COVID-19 vaccine hesitancy worldwide: a concise systematic review of vaccine acceptance rates,https://www.mdpi.com/1000750,QCYlILodRAQJ,"M Sallam - Vaccines, 2021 - mdpi.com","… for COVID-19 vaccine(s) in different countries worldwide, which can provide an initial step to study the factors implicated in regional and cultural differences behind COVID-19 vaccine …",687,"https://scholar.google.com/scholar?cites=307403359808464448&as_sdt=20005&sciodt=0,9&hl=en&num=20",307403359808464448,15,"https://scholar.google.com/scholar?cluster=307403359808464448&hl=en&num=20&as_sdt=0,9&as_ylo=2019",307403359808464448,PDF,mdpi.com,https://www.mdpi.com/2076-393X/9/2/160/pdf
18,1,19,,"Social norms and vaccine uptake: College students' COVID vaccination intentions, attitudes, and estimated peer norms and comparisons with influenza vaccine",https://www.sciencedirect.com/science/article/pii/S0264410X21002863,NR_vr2SusGIJ,"DA Abdallah, CM Lee - Vaccine, 2021 - Elsevier","… to get a COVID vaccine (91.64%) than an influenza vaccine (76.04%), and perceived COVID … The sample generally held strong intentions to receive a COVID vaccine and thought that …",46,"https://scholar.google.com/scholar?cites=7111375559089659701&as_sdt=20005&sciodt=0,9&hl=en&num=20",7111375559089659701,12,"https://scholar.google.com/scholar?cluster=7111375559089659701&hl=en&num=20&as_sdt=0,9&as_ylo=2019",7111375559089659701,HTML,nih.gov,https://www.ncbi.nlm.nih.gov/pmc/articles/PMC7965606/
19,1,20,,Why Cuba developed its own covid vaccine—and what happened next,https://search.proquest.com/openview/07c399ff04e0725795f5b4ee5f29c381/1?pq-origsite=gscholar&cbl=2043523,-YXvXVTWl3UJ,"L Taylor - BMJ: British Medical Journal (Online), 2021 - search.proquest.com","… Rather than negotiating with pharmaceutical giants or the Covax vaccine sharing initiative, Cuba bet everything on its prestigious biotech sector coming up with its own vaccine …",6,"https://scholar.google.com/scholar?cites=8473476881762452985&as_sdt=20005&sciodt=0,9&hl=en&num=20",8473476881762452985,8,"https://scholar.google.com/scholar?cluster=8473476881762452985&hl=en&num=20&as_sdt=0,9&as_ylo=2019",8473476881762452985,PDF,archive.org,https://scholar.archive.org/work/q45w4dhz2fge5nrbswjkydjymm/access/wayback/https://www.bmj.com/content/bmj/374/bmj.n1912.full.pdf
20,2,1,Html,A Review of the Progress and Challenges of Developing a Vaccine for COVID-19,https://www.frontiersin.org/articles/10.3389/fimmu.2020.585354/full,kMPSLdH_25UJ,"O Sharma, AA Sultan, H Ding, CR Triggle - Frontiers in immunology, 2020 - frontiersin.org","… of vaccine development. In addition to reviewing the different stages of vaccine development, vaccine platforms and vaccine … of a SARS-CoV-2 vaccine, the importance of a collaborative …",285,"https://scholar.google.com/scholar?cites=10798505805432931216&as_sdt=20005&sciodt=0,9&hl=en&num=20",10798505805432931216,14,"https://scholar.google.com/scholar?cluster=10798505805432931216&hl=en&num=20&as_sdt=0,9&as_ylo=2019",10798505805432931216,HTML,frontiersin.org,https://www.frontiersin.org/articles/10.3389/fimmu.2020.585354/full
21,2,2,Html,South African scientists copy Moderna's COVID vaccine,https://xencorps.com/8f12b7-ejcn2014235_articles/d41586-022-00293-2.pdf,irJgJYpndVAJ,A Maxmen - 2022 - xencorps.com,"… of creating it will lay the foundation for a more globally distributed mRNA-vaccine industry. … delivers the vaccine to cells. “We didn’t have help from the major COVID-vaccine producers,” …",3,"https://scholar.google.com/scholar?cites=5797653938339623562&as_sdt=20005&sciodt=0,9&hl=en&num=20",5797653938339623562,7,"https://scholar.google.com/scholar?cluster=5797653938339623562&hl=en&num=20&as_sdt=0,9&as_ylo=2019",5797653938339623562,HTML,xencorps.com,https://xencorps.com/8f12b7-ejcn2014235_articles/d41586-022-00293-2.pdf
22,2,3,Html,COVID vaccine use in inpatient psychiatry units—The need is here and now,https://www.ncbi.nlm.nih.gov/pmc/articles/PMC8006511/,im0_CEWDK84J,"L Li, W Kulp, M Goldman, M Sernyak… - General Hospital …, 2021 - ncbi.nlm.nih.gov","… While individuals can obtain the first vaccine dose in an inpatient psychiatric unit or long-… of both doses of a COVID-19 vaccine. In addition, vaccine distribution can be impacted by poor …",2,"https://scholar.google.com/scholar?cites=14856112128326069642&as_sdt=20005&sciodt=0,9&hl=en&num=20",14856112128326069642,5,"https://scholar.google.com/scholar?cluster=14856112128326069642&hl=en&num=20&as_sdt=0,9&as_ylo=2019",14856112128326069642,HTML,nih.gov,https://www.ncbi.nlm.nih.gov/pmc/articles/PMC8006511/
23,2,4,Pdf,Scientists probe how a covid vaccine could cause blood clots,https://bookcafe.yuntsg.com/ueditor/jsp/upload/file/20210508/1620474196618053079.pdf,B5WlZUc5xAIJ,"H Ledford - Nature, 2021 - bookcafe.yuntsg.com",… vaccine or other COVID-19 vaccines. It will also conduct lab studies to look for signs that the already-small risk could be cut further by reducing the amount of vaccine … the vaccine and …,2,"https://scholar.google.com/scholar?cites=199347262321956103&as_sdt=20005&sciodt=0,9&hl=en&num=20",199347262321956103,2,"https://scholar.google.com/scholar?cluster=199347262321956103&hl=en&num=20&as_sdt=0,9&as_ylo=2019",199347262321956103,PDF,yuntsg.com,https://bookcafe.yuntsg.com/ueditor/jsp/upload/file/20210508/1620474196618053079.pdf
24,2,5,Html,Ethics and execution of developing a 2nd wave COVID vaccine–Our interim phase I/II VSV-SARS-CoV2 vaccine experience,https://www.ncbi.nlm.nih.gov/pmc/articles/PMC8043614/,F2Z7glrB_oIJ,"Y Levin, NM Balakirski, Y Caraco, E Ben-Ami, J Atsmon… - Vaccine, 2021 - ncbi.nlm.nih.gov","… the 2nd wave of COVID vaccine development. Indeed, COVID-19 may evolve into new and more challenging variants, and humanity will require additional vaccines and vaccine trials, …",3,"https://scholar.google.com/scholar?cites=9439194463495480855&as_sdt=20005&sciodt=0,9&hl=en&num=20",9439194463495480855,5,"https://scholar.google.com/scholar?cluster=9439194463495480855&hl=en&num=20&as_sdt=0,9&as_ylo=2019",9439194463495480855,HTML,nih.gov,https://www.ncbi.nlm.nih.gov/pmc/articles/PMC8043614/
25,2,6,Pdf,An ethical path to a COVID vaccine,https://drum.lib.umd.edu/bitstream/handle/1903/26905/An%20Ethical%20Path%20to%20a%20Covid%20Vaccine%20_%20by%20Carl%20Elliott%20_%20The%20New%20York%20Review%20of%20Books.pdf?sequence=1,iPqw08VVqI8J,C Elliott - 2020 - drum.lib.umd.edu,"… a vaccine for Covid-19 is a “challenge study,” in which researchers give healthy subjects a prospective vaccine … typically give subjects either a test vaccine or a placebo and follow them …",8,"https://scholar.google.com/scholar?cites=10351618051659594376&as_sdt=20005&sciodt=0,9&hl=en&num=20",10351618051659594376,2,"https://scholar.google.com/scholar?cluster=10351618051659594376&hl=en&num=20&as_sdt=0,9&as_ylo=2019",10351618051659594376,PDF,umd.edu,https://drum.lib.umd.edu/bitstream/handle/1903/26905/An%20Ethical%20Path%20to%20a%20Covid%20Vaccine%20_%20by%20Carl%20Elliott%20_%20The%20New%20York%20Review%20of%20Books.pdf?sequence=1
26,2,7,Html,COVID vaccine efficacy against the B. 1.351 (“South African”) variant—The urgent need to lay the groundwork for possible future challenge studies,https://www.tandfonline.com/doi/full/10.1080/21645515.2021.1917240,hGduI3IPPd0J,"N Eyal, A Caplan, S Plotkin - Human Vaccines & …, 2022 - Taylor & Francis","… Janssen’s vaccine also did less well in South Africa than … Trials in countries without vaccine access would be ethically … of vaccine protection, and rigorously assess vaccine impact on …",4,"https://scholar.google.com/scholar?cites=15941915238856550276&as_sdt=20005&sciodt=0,9&hl=en&num=20",15941915238856550276,5,"https://scholar.google.com/scholar?cluster=15941915238856550276&hl=en&num=20&as_sdt=0,9&as_ylo=2019",15941915238856550276,HTML,tandfonline.com,https://www.tandfonline.com/doi/full/10.1080/21645515.2021.1917240
27,2,8,,… COVID-19 vaccines: An American Academy of Dermatology/International League of Dermatological Societies registry update on reaction location and COVID vaccine …,https://www.jaad.org/article/S0190-9622(21)02841-3/abstract,ToKv8uoNjVwJ,"EE Freeman, Q Sun, DE McMahon, R Singh… - Journal of the American …, 2022 - jaad.org","… The letter noted that the distribution of COVID-19 vaccine … as morbilliform, urticaria, or vaccine-related eruption of papules … Our study also captured an extensive vaccine reactogenicity …",3,"https://scholar.google.com/scholar?cites=6669001925950669390&as_sdt=20005&sciodt=0,9&hl=en&num=20",6669001925950669390,3,"https://scholar.google.com/scholar?cluster=6669001925950669390&hl=en&num=20&as_sdt=0,9&as_ylo=2019",6669001925950669390,,,
28,2,9,,Covid-19 vaccine hesitancy among ethnic minority groups,https://www.bmj.com/content/372/bmj.n513.long,d_djqh_PDhQJ,"MS Razai, T Osama, DGJ McKechnie, A Majeed - Bmj, 2021 - bmj.com","… the covid-19 vaccine if offered.1 However, surveys have indicated much greater vaccine … In a UK survey in December 2020, vaccine hesitancy was highest among black (odds ratio …",193,"https://scholar.google.com/scholar?cites=1445320265342121847&as_sdt=20005&sciodt=0,9&hl=en&num=20",1445320265342121847,11,"https://scholar.google.com/scholar?cluster=1445320265342121847&hl=en&num=20&as_sdt=0,9&as_ylo=2019",1445320265342121847,PDF,ucl.ac.uk,https://discovery.ucl.ac.uk/id/eprint/10123715/1/BMJ-2021-064614.R1_Proof_hi.pdf
29,2,10,Html,Offline: Managing the COVID-19 vaccine infodemic,https://www.ncbi.nlm.nih.gov/pmc/articles/PMC7834368/,oI-hlzpEe6gJ,"R Horton - Lancet (London, England), 2020 - ncbi.nlm.nih.gov",… one vaccine manufacturer are alleged to have sold “millions in stock as Covid vaccine trials … US Government punish Americans who refuse a COVID-19 vaccine. These stories may be …,25,"https://scholar.google.com/scholar?cites=12140372238950043552&as_sdt=20005&sciodt=0,9&hl=en&num=20",12140372238950043552,7,"https://scholar.google.com/scholar?cluster=12140372238950043552&hl=en&num=20&as_sdt=0,9&as_ylo=2019",12140372238950043552,HTML,nih.gov,https://www.ncbi.nlm.nih.gov/pmc/articles/PMC7834368/
30,2,11,Html,COVID-19 vaccination in the UK: Addressing vaccine hesitancy,https://www.thelancet.com/journals/lanepe/article/PIIS2666-7762(20)30016-8/fulltext,Zt63c5gmUVkJ,"K Sonawane, CL Troisi, AA Deshmukh - The Lancet Regional Health …, 2021 - thelancet.com",… With strategies to address COVID vaccine hesitancy in place and vaccine-related … of vaccine uptake. The Royal Society and the British Academy recently put forth strategies for COVID-…,34,"https://scholar.google.com/scholar?cites=6435967778707463782&as_sdt=20005&sciodt=0,9&hl=en&num=20",6435967778707463782,5,"https://scholar.google.com/scholar?cluster=6435967778707463782&hl=en&num=20&as_sdt=0,9&as_ylo=2019",6435967778707463782,HTML,thelancet.com,https://www.thelancet.com/journals/lanepe/article/PIIS2666-7762(20)30016-8/fulltext
31,2,12,,A global pandemic in the time of viral memes: COVID-19 vaccine misinformation and disinformation on TikTok,https://www.tandfonline.com/doi/abs/10.1080/21645515.2021.1894896,NFkiWmuvUVIJ,"CH Basch, Z Meleo-Erwin, J Fera, C Jaime… - Human Vaccines & …, 2021 - Taylor & Francis","… concern that COVID-19 vaccine decision-… for COVID-19 was increasing in the country, vaccine hesitancy nevertheless remains of utmost concern. Without widespread uptake of COVID-…",36,"https://scholar.google.com/scholar?cites=5931715059832215860&as_sdt=20005&sciodt=0,9&hl=en&num=20",5931715059832215860,6,"https://scholar.google.com/scholar?cluster=5931715059832215860&hl=en&num=20&as_sdt=0,9&as_ylo=2019",5931715059832215860,PDF,tandfonline.com,https://www.tandfonline.com/doi/pdf/10.1080/21645515.2021.1894896
